,reviewId,userName,userImage,content,score,thumbsUpCount,reviewCreatedVersion,at,replyContent,repliedAt,appVersion
671,9415cd55-c052-4dd3-a82e-b7872ba12b99,Makbardanumukti,https://play-lh.googleusercontent.com/a-/ALV-UjWReFZnRACrteKuk_tXTvaIOi8V0wH5ipEOT3FPcrfut8M,"Kok sekarang nggak bisa lawan komputer, perasaan dulu bisa, ah jadi nggak seru padahal kalo lawan komputer sekalian latihan, dan mode rookie kok masih belum bisa",3,0,1.20.2,2021-11-18 04:29:32,,,1.20.2
672,5ba98ffb-7bb5-43e3-afc9-195cc8934a59,fayola aerish,https://play-lh.googleusercontent.com/a-/ALV-UjWBb8wzHC7ONGpV2kTrLakT0-_I2Txe076X2h_N91k6e5Qq,"Habis main 1 level pasti keluar dari game, loadingnya lama puls.....tolong di perbaiki developer, sudah bagus sebetulnya",2,4,3.4.21,2022-03-04 05:18:45,,,3.4.21
673,7ff1960b-e4b5-428e-8313-9acc5bbbc1ac,Elyya Siregar,https://play-lh.googleusercontent.com/a-/ALV-UjWDHdUOFbC6AEuRtVLDeFBlauJ151jiz7uCZoOtLdWX9Q,Awal nya gw kira grafiknya masih low tapi pas saya main ternyata grafiknya hd anjir dan juga Developernya tambahin mobil mobil lain jangan mobil F1 doang kek mobil speedway mobil lambo dan dll lah kalo udah ditambah gw bakal end ini game beneran,5,1,,2021-03-24 15:37:00,,,
674,9c5efe98-714b-45d6-897e-624ea66682bc,Christianto Sukwendy,https://play-lh.googleusercontent.com/a/ACg8ocKeUTCu9pWflK5xFk2iGy0WAuWzBTINaZkoXNOxmhGe=mo,"Game tidak masuk akal. Lawan lewat pasir kecepatannya tetap stabil, bahkan tambah kencang. Tapi kalo saya yg naik pasir, kecepatan menurun drastis. Game goblok!!",1,3,2.4.2,2020-09-28 06:44:38,"Hello, when you drive outside of the track limits, your car noticeably slows. This is also true for your opponent. However, sometimes, due to latency in either your connection or your opponent's, the position of other players can be inaccurately displayed on your device and it may look as if your opponent is driving off-track. Thanks.",2020-09-29 09:02:06,2.4.2
675,1d6e8dbc-4387-40e4-bd48-4f719a19e8e2,Pengguna Google,https://play-lh.googleusercontent.com/EGemoI2NTXmTsBVtJqk8jxF9rh8ApRWfsIMQSt2uE4OcpQqbFu7f7NbTK05lx80nuSijCz7sc3a277R67g,"Iklan, iklan, iklan.... terlalu banyak. Sudah download gede tetap aja iklan gak dilupakan, Hilangin donk. Dikira main gamenya offline ternyata harus online buat nigkatkan performance.",2,23,1.21.19,2020-02-23 17:48:15,,,1.21.19
676,f62a9b7f-029d-472b-aa12-3fb2f260f186,Ari_Lybaz,https://play-lh.googleusercontent.com/a-/ALV-UjUSftS_C7m5w-JRqxulhRVYX0J4DQRFA4seega6z-X9dMk,"Untuk lampu belakang tetap digunakan walaupun tidak dalam kondisi hujan, terutama saat balapan malam hari, ada spot yang kita tidak bisa melihat lawan di depan. Kemudian percikan api pada knalpot agar ditambahkan biar semakin real.",5,0,,2022-11-27 14:31:24,,,
677,3dfdd717-6d2b-4df3-8dbb-bd4e7ba4b9c8,Putra Bungsu,https://play-lh.googleusercontent.com/a-/ALV-UjXbonAia_Tk6sYPPuxVIPwZDXkYNF8b9eDUe04g5G1_0pg,"Game terlalu bagus,saking bagusnya download track aja lama,padahal jaringan wifi tokcer, akhirnya gua uninstal aja ,game sebelah masih ada yang lebih bagus dan gk lemot !! 😁😁",1,0,,2020-11-25 16:06:50,,,
678,e5418a3a-0936-4281-a544-571c4ea11e85,Satriya kun,https://play-lh.googleusercontent.com/a-/ALV-UjXg89iwxhjgXfUQEucn2ykNW6ZWnY9vwmkSG78sg3qF1A,"Gameplay nya udah bagus saya suka, tapi karena ada iklan gk jelas muncul terus, sama kadang suka reconnect dari game, jadi kesel sendiri mainnya",2,7,3.4.21,2022-02-22 13:12:41,,,3.4.21
679,5534ac57-c1db-4692-bc86-857ca4729c5d,Pengguna Google,https://play-lh.googleusercontent.com/EGemoI2NTXmTsBVtJqk8jxF9rh8ApRWfsIMQSt2uE4OcpQqbFu7f7NbTK05lx80nuSijCz7sc3a277R67g,Game ini sangat seru sekali. Edit: untuk Developer Code Master dimohon tolong tambahkan mode hujan dan lain sebagainya. Agar suasananya lebih realistis seperti aslinya.,5,13,1.18.16,2019-11-15 05:44:41,,,1.18.16
680,c648216d-9f81-4b35-bbbe-4ccee31e09be,Naufal Hadi,https://play-lh.googleusercontent.com/a/ACg8ocI9ATgK_tXRrfIgbCn8XYlK_-EuHkIFJZfszkApCc6J=mo,"Kenapa download track lama banget pada hal cuma 100mb, pada hal hp saya samsung galaxy note20 ultra 5g yang memory 512gb dan ram 12gb, udah makai kuota lama dan wifi lama, ampun dah nih kacau pengembang gamesNya, tolong perbaiki gamesnya!!!",1,42,3.2.16,2021-11-17 19:26:40,"Hello, we're sorry that you've experienced issues. Could you please use the ""Help & Support"" function in the game, and give us more details about the problem you're facing?",2021-11-18 16:30:59,3.2.16
681,7f0842a9-65d5-4066-bab9-9b7429952118,Pengguna Google,https://play-lh.googleusercontent.com/EGemoI2NTXmTsBVtJqk8jxF9rh8ApRWfsIMQSt2uE4OcpQqbFu7f7NbTK05lx80nuSijCz7sc3a277R67g,"Game buruk, buat apa grafik kalo jaringan server masih buruk. Bentar bentar reconect. Padahal itu pake wifi jaringn super bagus. Tolong perbaiki woyy. Game babi",1,3,1.20.2,2020-01-23 03:26:00,"Hello, we invite you to check our FAQ regarding connection: https://codemasters.helpshift.com/a/f1-mobile-racing/?s=troubleshooting&f=how-can-i-ensure-the-best-connection-to-the-game
Thanks.",2020-01-24 09:53:35,1.20.2
682,e9275ed5-f2e8-4564-96cf-93b9fe514ba7,Arnandoinyoman@yahoo.co.id Ardo,https://play-lh.googleusercontent.com/a/ACg8ocLzHZNtmynik3H2ul7KUvw1R838tbYDMkCLdZlA2J7h=mo,"Lawan nya gk sesuai level kita, selalu ketemu lawan level tinggi, dan report nya gk terlalu baik , kita gk tau itu ditindak atau gk , kalau lawan balapannya agresif.",1,0,,2022-08-30 01:51:03,,,
683,d6cf0355-99f6-4283-851c-472f8907e737,014,https://play-lh.googleusercontent.com/a-/ALV-UjXTUTWy59XEJdVA4ovs95A4ZuVVQQ8F8tLHs5nTTTihyrQ,"udah jadi dead game kyknya, main duel aja masih erorrr conection kecepatan 600kb/s saat masuk duel ko malh ga nemu2 lawan,tolong developer perbaiki dulu kenyamanan gameplay para player jangan membuat hal2 yang membuat kacau balau gara2 server anda erorrr!!! Saat ini masih belum bisa tanding duel kenapa!!!servermu parahhhhh!!!😠😠😠😠😠😠😠😠😠😠😠😠😠😠padahal dari gamenya sudah memuaskan malah lebih2 sangat puas,karena servermu OLD/sealalu erorr kepuasan gameplay kami berkurang,plis tangani itu",1,1,,2020-12-29 09:25:36,,,
684,cf292f9d-a619-4ce5-a422-027885902db5,Zulfi Ziaul,https://play-lh.googleusercontent.com/a/ACg8ocIK0k982Q-fF6U_dM6zf7tEjwpV_NcYVeWqHrEBtjYZ=mo,"Game nya seru, lebih banyak reconnect nya dibanding main game, jika kalian cari aplikasi untuk cek jaringan provider ini aplikasinya, gajelas blok",1,6,4.7.4,2023-06-08 20:52:50,,,4.7.4
685,d779ec36-d175-4fa0-a4bb-5d0d4ed38171,Argo Kemod,https://play-lh.googleusercontent.com/a-/ALV-UjUxlp-nd9z0MCx7OiWhdM43ZfwLlmeaMIFUkSJgru4h9Fk,Untuk game ini control udah enak .. cuman tampilan nya kek game 200mb an . Suara mobil nya ga enak banget gak real . Grapich nya ga real .. ga bisa set grapich .. Untuk game balap ukuran 1gban . Ga work it. Mohon di tingkatkan lagi .. Sayang sama lisensi f1 nya . Untuk yang sayang kuota mohon di pertimbangkan download nya . Testimoni ku bintang berbicara. 🙏 Saya harap dari.gameplay.dan.kontrol.grapik.ngikutin real racing3 perfect bnget itu game . Ea.❤️,1,16,1.20.2,2020-12-08 00:39:51,,,1.20.2
686,a5c44b4e-3e10-44ee-8c76-59591c4fe931,Faras Ayas,https://play-lh.googleusercontent.com/a-/ALV-UjWP3Q7lQF0ASBsAUsR-E39y5RU8SdmBaRKSxPA-hv6Brw,Ini kenapa ya kok saya sudah main lama banget sampe duit banyak setelah rehat beberapa bulan coba download lagi tapi malah akun nya di bilang corrupted ini gimna sih jadi gabisa pake akun gmailnya,1,0,,2022-10-10 22:05:59,,,
687,77d75ba3-8d2d-418e-8b94-b348fa03cdfd,Nicolas Christian,https://play-lh.googleusercontent.com/a-/ALV-UjXbb9TjYq2l88JE8vdFTP8IVqs1UIqtTPHKQKNs4ZekcT0,"Mode karir pas download sirkuit kok ngebug ya? Download progress ga nambah2, saya tinggal 10 menit masih tetep 0 MB. Sementara bintang 1 dulu sampe saya bisa download sirkuit.",1,0,4.3.19,2022-12-02 18:59:18,,,4.3.19
688,a9c51b65-6c14-4f3f-b366-033ff00fe1e8,Kenzie Dirmanto,https://play-lh.googleusercontent.com/a/ACg8ocIYDhI5354AZyWETVQupgmDYO2fUbJd3oyfbpid9ksA=mo,Cara setting grafik di game ini gimana ...kok punya saya ndak muncul pilihan settingan,4,1,5.0.39,2023-06-20 13:49:23,,,5.0.39
689,bbd9c159-b233-4922-915c-4f09d58ff504,Gregorius Jhosantha,https://play-lh.googleusercontent.com/a-/ALV-UjWMSNC_vyukJwYUUBj1fndtg5CnG7CO__BZ_nQiDNascQ,"Gamenya sudah bagus,tpi hanya satu hal yang kurang yaitu pitstop dan menajemen ban dan untuk tambahan dari saya, tambahkan carier mode untuk world championship",5,3,2.0.26,2021-09-13 02:28:10,"Hi, thank you for your feedback. Our team is regularly making updates and changes based on community feedback, so your comments have been noted and taken on board. Thanks!",2020-06-24 09:33:10,2.0.26
690,b790f4af-64a9-4f8f-b0e1-2e2d92321a30,Pengguna Google,https://play-lh.googleusercontent.com/EGemoI2NTXmTsBVtJqk8jxF9rh8ApRWfsIMQSt2uE4OcpQqbFu7f7NbTK05lx80nuSijCz7sc3a277R67g,"overall nice tapi tolong tambah kan agar bisa masuk pitstop,tukar ban dan lain nya agar seperti asli nya tolong di hadirkan pasti game ini menjadi sangat menarik sekali",3,4,1.11.3,2019-06-29 15:11:27,,,1.11.3
691,eb826793-e5fc-481f-a181-deb0ed83990a,Pengguna Google,https://play-lh.googleusercontent.com/EGemoI2NTXmTsBVtJqk8jxF9rh8ApRWfsIMQSt2uE4OcpQqbFu7f7NbTK05lx80nuSijCz7sc3a277R67g,"game yang sanagat bagus hampir seperti real untuk android, untuk pembuat game kalau bisa buat yang versi motogp seperti game ini, kami yakin akan lebih banyak peminat game nya. thanks....",5,34,1.5.8,2018-12-20 03:57:56,,,1.5.8
692,ae21be93-da04-4930-bc6e-6ad32edb47e4,deddy putranto,https://play-lh.googleusercontent.com/a-/ALV-UjW-vQIAH7tt7A2FM91zQ2yqyc7QKrbpjErDnyZXOyR8a1A,"Koneksi data buat youtube, IG, WA lancar.. Namun untuk main ke sini selalu reconnect untuk masuknya. Mohon segera diperbaiki",1,1,1.22.8,2020-05-16 13:03:26,,,1.22.8
693,4cbc96ab-8041-4687-90b9-d1506d0e8f98,ARNANDO RIKARDO,https://play-lh.googleusercontent.com/a-/ALV-UjW2NiZXmjE9W82z5f6rZUsZ4Tnt-GONuDbfCEF84pTn0no,"soal grafik gak masalah,tapi soal hukuman yang potong tikungan dihapus ajalah.karena gak semua bisa mulus lewat tikungan gw sering overster gegara grafiknya patah. terus player banyak yang kelakuannya buruk,sering nabrak.parah emang,panter bintang jeblok.",1,0,,2021-10-27 11:38:43,,,
694,125692eb-342b-4379-9376-1a1b82d08d52,Aldo Revanza,https://play-lh.googleusercontent.com/a-/ALV-UjWD5qu_Bff94ZH0_P2DixAtsfLTvMIjlYDAgy2iXr_JWiU,"ini kenapa ya di hp saya kok nge lag nge lag gitu di beberapa sirkuit contoh di sirkuit, abu dhabi, silvertone, sao paulo gitu. tolong solusi nya!!!! kalau main jadi ga nyaman padahal ini game bagus banget",3,46,2.7.6,2021-04-21 15:47:39,,,2.7.6
695,f6bf8350-f66d-4e6b-a1cf-ed1501ad6c9f,Pengguna Google,https://play-lh.googleusercontent.com/EGemoI2NTXmTsBVtJqk8jxF9rh8ApRWfsIMQSt2uE4OcpQqbFu7f7NbTK05lx80nuSijCz7sc3a277R67g,"Semuanya sih udah mantap tapi tolong dong dibuat bisa memilih ban dan dapat masuk pit stop supaya lebih mantap lagi dan tambahkan cuaca juga biar balapnya semakin seru,semoga saran saya diterima dan segera direalisasikan",5,114,1.21.19,2020-02-25 15:27:32,,,1.21.19
696,48d57038-a35a-429d-bf82-8b6063df3da1,10_Dafara Ryan,https://play-lh.googleusercontent.com/a-/ALV-UjWW7og4Qk6vD3tCUXan7_Jn3v198hNhPvPV4n08fpHNAms,"Kenapa ya kok pas masuk pakek wifii gak bisa, setelah di ganti paketan baru bisa masuk. Tolong dong di perbaiki bagian itu, padahal seru lo gamenya",3,12,2.6.15,2021-01-09 01:06:36,,,2.6.15
697,8849ae75-13d2-449e-9b0a-884ffbd0b782,Huda Firdaus,https://play-lh.googleusercontent.com/a/ACg8ocJKzPRkptvSJ8D6u7RXbeRWJr9H97zHVfigeyCTNnBT=mo,masih sering ada bug nya gw kasih bintang 4 dulu,4,0,5.1.11,2023-07-22 04:57:57,,,5.1.11
698,9fef6553-1c91-4a11-a807-57f901dc2612,Pengguna Google,https://play-lh.googleusercontent.com/EGemoI2NTXmTsBVtJqk8jxF9rh8ApRWfsIMQSt2uE4OcpQqbFu7f7NbTK05lx80nuSijCz7sc3a277R67g,"tidak bisa masuk game pada saat download data,stuck di 3/4 di ulang masuk loading screen tetep gak masuk"" dengan alasa jaringan error, saya main PUBGM lncar"" aja",1,7,1.5.8,2018-12-24 04:49:42,,,1.5.8
699,d5ccbbbf-b9c7-4878-8884-5cadf63ba4f2,palesman,https://play-lh.googleusercontent.com/a-/ALV-UjXQrVkF0HN938Ssa3ysycAAIhaCbsexeD843lWhMB2d3A,"Parah lawan online nya kaga ngotak, masa level 12 disuruh lawan level 30+ NGOTAK DONK. Terus masa gua mau liat iklan aja buat dapet item free, iklannya kaga ada ANEH!!!",1,4,4.1.8,2022-07-17 01:09:02,,,4.1.8
700,b169d5d3-004b-41f8-a2de-6b5ded4d310b,Pengguna Google,https://play-lh.googleusercontent.com/EGemoI2NTXmTsBVtJqk8jxF9rh8ApRWfsIMQSt2uE4OcpQqbFu7f7NbTK05lx80nuSijCz7sc3a277R67g,"saya sudah download, pas mau main loadingnya kenapa lama banget. katanya koneksi eror.padahal jaringan 4G.tolong di perbaiki di halaman loading pertama masuk game",1,0,,2019-01-12 18:39:56,,,
701,7224fdd2-4e0b-4e4c-b06a-7d4c6ffd1e04,Mahatir Muhammad,https://play-lh.googleusercontent.com/a-/ALV-UjU-pN5p5Whvf3JAIBJhOD29HopBgjH26sAdnVvLD80XiTk,"Kalian mau tau kenapa kalian reconnecting? Itu semua karna kalian buka jendela menu pas kalian lagi login/matchmaking, emang aneh, tapi hanya itu caranya",5,0,,2022-03-30 06:04:20,,,
702,9fb533e4-ed29-4dd5-8b49-697be311f2d7,Helmy Estriawati,https://play-lh.googleusercontent.com/a/ACg8ocKst9762xwQ2CC7dAejyLCLgEvbmSVUYhHk1igxsEhr=mo,Game ini sudah bagus grafik bagus hanya donwload tracknya lama banget sumpahh aku kasih bintang 3 dulu ya soal nya donwload tracknya lama banget kalau udah cepat aku kasih bintang 10 hanya nggak bisa kasih bintang 10 pokoknya harus cepat donwload tracknya developer ya sekian dan termakasihhhh,3,2,3.2.16,2021-11-23 09:29:36,,,3.2.16
703,709f3fb4-6771-409c-8401-0a110f4ab9e5,give u up,https://play-lh.googleusercontent.com/a-/ALV-UjVxWvDrFx_mgU-9mcUy0IjrMTfyAAYHskFJz982nL9vPR0,gamenya i mean... sim this is a pro sim bagus banget tapi yang kurang sih saat first person mohon ditambahkan halo atau tidak dikasih opsi untuk menambahkan halo atau di hilangkan dan juga tambahkan sedikit camera shake di first person,4,0,2.5.6,2020-10-29 13:13:36,,,2.5.6
704,3a069bcc-3d6d-4250-84d0-a2f7230c664f,Pengguna Google,https://play-lh.googleusercontent.com/EGemoI2NTXmTsBVtJqk8jxF9rh8ApRWfsIMQSt2uE4OcpQqbFu7f7NbTK05lx80nuSijCz7sc3a277R67g,"Game menarik, track balapan sesuai dengan aslinya, namun sayang masih banyak sekali bug bug yang harus di perbaiki developer, sementara 1 bintang dulu",1,5,1.5.8,2018-12-30 09:05:29,,,1.5.8
705,a76e8f9e-e0f9-4bbc-a2a3-a46166596bd4,Pengguna Google,https://play-lh.googleusercontent.com/EGemoI2NTXmTsBVtJqk8jxF9rh8ApRWfsIMQSt2uE4OcpQqbFu7f7NbTK05lx80nuSijCz7sc3a277R67g,"ni games masih banyak kurang nya ,, terutama control,terlalu susah kalo grafik ok lah .. tolong mid tingkatkan lagi controlnya",3,0,,2019-01-14 00:11:25,,,
706,0f1e7eae-7b0f-43d9-8250-8a0950c5a2af,Pengguna Google,https://play-lh.googleusercontent.com/EGemoI2NTXmTsBVtJqk8jxF9rh8ApRWfsIMQSt2uE4OcpQqbFu7f7NbTK05lx80nuSijCz7sc3a277R67g,Game nya bagus real like F1 asli cmn sayang sering reconnect jaringan padahal WiFi bagus pake jaringan 4g full namun sering reconnect Kalo sudah. Lebih baik bisa di tambah bintangnya,3,3,1.18.16,2019-11-09 03:30:46,,,1.18.16
707,f9a2acca-c4e4-47dc-8e3d-972ed05e0aee,Muhamad Fahmi Yusup,https://play-lh.googleusercontent.com/a-/ALV-UjXpq-FhNSN5J6p-_F2R0hBPQphKEfjK3CvjdmUwPJZ8Egnd,"Mobil susah di kontrol Dan yang paling tidak nyaman itu, selesai balap selalu muncul iklan. Semoga kedepannya lebih bagus lagi. 👍",3,1,,2021-01-15 20:11:33,,,
708,9d698440-86fb-43f1-ac47-05fe33d3e0f6,Pengguna Google,https://play-lh.googleusercontent.com/EGemoI2NTXmTsBVtJqk8jxF9rh8ApRWfsIMQSt2uE4OcpQqbFu7f7NbTK05lx80nuSijCz7sc3a277R67g,tolong perbaiki saat start di grid.. tidak ada perbedaan antara good start & perfect start.. tolong ditambahkan jadi 2 lap untuk battle online...,3,0,,2018-12-26 00:40:26,,,
709,4a70507d-22c7-4dda-a7bb-a122faa6085f,Kampretto Ch,https://play-lh.googleusercontent.com/a/ACg8ocIGmBK9BVHJnobDKtlYWbDBMRXFBHxma8lL1Q6aYbN2=mo,Saya kasih bintang 5 game nya keren mirip aslinya cuma kurangnya di kecepatannya tidak sampai 400 kmh lebih cuma 260 lebih padahal f1 1500 cc 8 speed masak larinya tidak sampai 300 atau 400 kmh terus track nya kurang masih sikit masih banyak la pokoknya yang kurang tolong perbaiki lagi developer f1 nya.,5,21,2.0.26,2020-06-03 01:07:40,,,2.0.26
710,1606ad84-a472-46b9-8e68-43536b603d21,Robit.J7,https://play-lh.googleusercontent.com/a-/ALV-UjUCFyTlSDzZNBJTqx8kbDJZdee5PkdWM0YTmPsa8dnjKw,Game nya bagus banget tapi harus di tingkat kan lagi tekstur jalan dan bisa ke pitlane ganti ban dan cuaca nya juga bisa hujan dan sirkuit nya harus sesuai 🙏😇 aku akan menunggu updet berikut nya,5,0,,2021-12-18 10:54:07,,,
711,32eaafbf-795f-4cbe-8909-0c086d2de32f,Pengguna Google,https://play-lh.googleusercontent.com/EGemoI2NTXmTsBVtJqk8jxF9rh8ApRWfsIMQSt2uE4OcpQqbFu7f7NbTK05lx80nuSijCz7sc3a277R67g,"Banyak bug, lawan bootnya terlalu mudah tolong ditingkatkan, ada fitur bisa pilih lawan dong!!!",3,2,1.22.8,2020-04-10 16:00:02,,,1.22.8
712,d8e24f9d-0f1e-4650-84d2-da910ef5da44,Bahrul Musyahadah,https://play-lh.googleusercontent.com/a-/ALV-UjUAyI3jNEBP7u6TpJL9b5msDJDgqR9PqVjEnCDy2TONPLYw,"Sering disconect.dan juga kalo habis update selalu download ulang track.download tracknya harus pake data internet,kalo pake wifi malah gak bisa.harus diperbaiki lagi.",1,2,4.2.26,2022-08-26 01:59:32,,,4.2.26
713,94af6ae7-5482-407b-ad88-5666f3a384d6,Deni,https://play-lh.googleusercontent.com/a-/ALV-UjUCouM_4e3OZpHOZFFrK8QivcvRAQOSc6dsuJDM1liUDW4,1.setelah update grafik menjadi ngk nyaman enakan yang dulu 2.terlalu sering ngeframe padahal hp memadai 3.untuk balapan biasa yg tidak duel kenapa dihilangkan padahal bagus untuk berlatih.intinya kembalikan grafik nya seperti dulu,2,2,3.0.24,2021-10-08 02:22:24,,,3.0.24
714,d183fa18-b70e-4e87-9051-ad9a67d8a18f,Mohamad Azril Halim,https://play-lh.googleusercontent.com/a/ACg8ocIXzL3GTtNKghdeqyY10nn8NPLptlSum77HAqb6aVvW=mo,"Gamenya bagus, tapi kalo tanding lawannya gaseimbang mulu kalo lawan keluar jalur tetap kenceng amat, tapi kalo saya keluar jalur jadi pelan. Tolong developer",2,2,3.5.11,2022-04-13 15:58:14,,,3.5.11
715,64a18ccd-c3d5-40b5-a22c-9b55a1058187,Pras Prasetyo,https://play-lh.googleusercontent.com/a/ACg8ocLYoOerN4m3Uw4fVSX7hhIOuJT-sWgYoDXa1xgCbEW3=mo,"Sangat buruk, tidak bisa menikmati gamenya dengan maksimal karena sering koneksi terputus padahal sinyal sangat bagus",2,0,,2023-08-09 04:20:24,,,
716,dbb811e2-ed42-46a0-87a0-ec9c8d1712e2,Mohammad Awwaluddien Azmil Fajri,https://play-lh.googleusercontent.com/a-/ALV-UjWr41fvEVXXKH6DUqKATLEKVMTGJ85_2aCMLjjyNVgCLCA,"Masih ada bug tapi udah bagus, di race Hungaria malah start grid nya kebalik, yang bagus"" di belakang yang tim bawah malah di depan semua",3,12,4.0.48,2022-07-02 12:07:14,,,4.0.48
717,49dbf185-7f91-43b1-84c1-30369918ea17,Pengguna Google,https://play-lh.googleusercontent.com/EGemoI2NTXmTsBVtJqk8jxF9rh8ApRWfsIMQSt2uE4OcpQqbFu7f7NbTK05lx80nuSijCz7sc3a277R67g,"Tolong lap nya di tambahin, jangan cuma 3 lap aja. Lebih dari itu kan bagus, misal nya 15 atau 10 lap saja, atau bisa Samapi 20 lap, kan keren",2,0,,2020-04-23 16:07:27,,,
718,a31f4af7-a79f-4cb2-b422-053ef993ebcc,Herna Rezika,https://play-lh.googleusercontent.com/a/ACg8ocK0AzU9Rfl5Yl1KtnW9hxKhe3ugJL8lyxz4b45-HUxy=mo,"Saat memainkan game ini, serasa seperti real, tapi sedikit kekurangan di bagian ""pencarian lawan "" jadi agaknya di perbaiki, terimakasih",4,0,4.3.19,2022-10-10 23:40:30,,,4.3.19
719,face3664-d19c-4e85-a3fb-2f55a2e9a495,Sigit Adhi Nugroho,https://play-lh.googleusercontent.com/a-/ALV-UjUgf_fQtgvRB31ClWLbsOUzEHXkXRRTKdRWqH1Fn7Mgozo,"Menurut saya Game ini adalah Masterpiece RECCONNECTING yang selalu muncul dapat mewarnai permainan ini, selain itu gameplay dari game ini juga salah satu yang terbaik dan pertandingan yang paling saya ingat adalah Saya melawan server pertandingan ini membuat saya bersemangat naik dan turun dalam waktu yang singkat.Seperti yang katakan di atas game ini adalah sebuah Mahakarya",1,5,4.4.43,2023-02-11 12:31:03,,,4.4.43
720,7364510e-1ebd-4369-b9b4-15c2051f701c,Andri Yansyah,https://play-lh.googleusercontent.com/a/ACg8ocILatF0pMlugYpIi8JWCHOWeAE0Vvk3IOf1PWGkZSJQ=mo,"Masalahnya Reconnect mulu, padahal sinyanya bagus, erorr, segera di perbaiki secepatnya, agar bisa di main kan langsung setelah di dowunload",2,22,2.7.6,2021-05-06 10:18:23,,,2.7.6
721,69e1d608-0bb8-4458-9b18-e568068c8b8c,waysan,https://play-lh.googleusercontent.com/a-/ALV-UjX_1QGlc8fkb8tYcBI7w3iWmQmMczThdZNCoOKMcdYx2qw,"Yang kasih bintang 3 ke bawah dan banyak alesan gamenya ini lah apa lah bla bla bla, yaa kalo dasarnya anda tidak bisa main gak usah banyak alesan cupu ya cupu aja, kalian main masih pakai steering assist sok keras banget cupu ya cupu aja boss, dan lagi kalo download track pake wifi memang lama kalo mau agak cepat ya pake kuota aja, kalo yang sering diconncet pdhl sinyal bagus jangan buka notification scroll bar pas main duel nanti kena suspend, dan 1 kalo yang sering force close GANTI HP AJA!!!",5,36,2.8.4,2021-09-04 09:01:38,,,2.8.4
722,b71f8e19-e317-45d7-857b-d416582af509,cedric cedric,https://play-lh.googleusercontent.com/a-/ALV-UjWmouyhR_zclTMoxHP3wMlP_hkN9I3qCjSQPMt0TVdk40M,Setiap main multiplayer selalu musuhnya tidak seimbang jadi saya kalah terus menerus dari 8000 point menjadi 5760 point lama lama main ini menjadi bosan saya harap kedepannya musuhnya seimbang jadi aku bisa main dengan tenang,1,23,3.4.21,2022-02-19 12:31:28,,,3.4.21
723,a7038e3a-02cf-4d48-8416-c3a48122afa3,fathan berlan,https://play-lh.googleusercontent.com/a-/ALV-UjUv3-AKxQHtnZHYVwI56bmaLR3pOLm7ytG0neh9zx8pnM4,Ini sangat bagus dan grafik,5,1,5.1.11,2023-07-14 05:33:11,,,5.1.11
724,aed2f608-c1c6-4041-b325-a313166224bf,Rama Surya,https://play-lh.googleusercontent.com/a/ACg8ocLZ94ZXcARfd3zUdTkKMypz3yxuVbaWM55d_8VxWy4M=mo,"Gamenya seru, grafik oke,. Kendalanya wifi lancar tpi malah menyambungkan terus, download map ga bisa pakai wifi/ harus pakai data",3,0,,2022-12-18 00:59:11,,,
725,008bc8af-da03-402f-be84-11ad97a37c9f,Rasya Aditama 123,https://play-lh.googleusercontent.com/a/ACg8ocKQs8vfLs0UDJZidrttatW9gKdT9xhoQrR5209zpAc8=mo,Kenapa saya kalo duel online saya hanya menang sekali dalam 4 pertandingan saya sangat kecewa apalagi ada yang sengaja nabrakin mobilnya tolong di perbaiki!!!!!!!! Pihak developer!!!!,4,54,2.3.14,2020-09-10 06:38:20,"Hi, thank you for your feedback. Improving the engine penalty system is among our priorities and we will continue to develop this feature. By keeping the Safety Rating high, you can increase your chances of pairing with players with high Safety Rating in duels. You can also report players who race unfairly at the end of the duels. Thanks!",2020-09-03 10:29:23,2.3.14
726,a0f1f55a-3962-4a5d-955f-54a3bc02d469,Mu'ammar Gadafi,https://play-lh.googleusercontent.com/a/ACg8ocL62sHiO0ojS16ya6HBBuccTF_JKxtOFp8Y_870nbQu=mo,"Sudah bagus dan cukup baik, akan jauh lebih baik tambahkan sistem pitsstop biar lebih real lagi terus adain spion donk buat melihat musuh yang di belakang",3,9,2.7.6,2021-05-06 01:29:56,,,2.7.6
727,53ed88eb-f81d-4ea5-9918-9c0073896216,Agustian PR,https://play-lh.googleusercontent.com/a/ACg8ocJKSCp1pNJ8C686P6qJ6A4Zv5zY9zZzuVxrF-WaZ2uy=mo,"Bikin ada fitur pilihan ban dan masuk pit, sama cuaca di buat bermacam macam, lap juga di tambah lagi, masa max cuma 15 lap, itu pun kalau main singgle, kalau main vs cuma 1 lap",4,0,,2021-09-27 15:15:07,,,
728,d24b22d0-7dcd-4eca-949a-fc6fb5512817,Zet447,https://play-lh.googleusercontent.com/a/ACg8ocI4YdfTn_qcfSIqdUSK30_-iZGxi9Bd9QnmWzFmWi-I=mo,"Masalah , bagaimana cara untuk pindah contract saya sudah klik sign in contract berkali kali tapi tidak ada respon tanggapan atau apapun, internet ku bagus no lag",1,1,4.2.26,2022-09-03 03:04:31,,,4.2.26
729,0aa535b7-0163-4380-97a2-c663e3687020,Ferdy Kilua,https://play-lh.googleusercontent.com/a/ACg8ocKbSpQjFQX35CUNwgl9Mc1v52yH1DKcLULlCLO7E7zs=mo,"Tolong adain pit stop dan race nya jangan 1-3 lap, kalo bisa bikin 10-60 lap seperti aslinya dan ada nya pengganti ban dan pengaturan mesin, seperti yang di PC",3,0,3.2.18,2021-12-17 12:11:24,,,3.2.18
730,68b8bc15-9c48-4f5e-9087-5b079eca2eab,Al_baihaqi,https://play-lh.googleusercontent.com/a-/ALV-UjVwtkUAA5oNWl3oIETY-3fRPYzSEQBmOIxDL4pPtfo6hJg,"Game yang bagus, tetapi masih ada bug yang harus di fix dan juga ketika download map, mengapa sangat lemot bahkan selalu eror padahal internet saya sangat bagus",4,0,,2021-12-03 08:14:28,,,
731,16b45021-e93c-444f-b780-f5df847fd302,PokiPoki ProDakGagal,https://play-lh.googleusercontent.com/a-/ALV-UjW34YRWQ0vj8UURlujLSihUkKfz1suCHdH8yk62l5TycQ,"Masih terdapat bug AI tiba tiba berhenti ditikungkan,dan saran collision Shield hanya aktif untuk antar pemain aja jangan dengan AI juga sering terjadi saya terhalang AI sedangkan lawan tidak",4,0,,2020-09-23 03:53:36,,,
732,4a7602c3-be4a-47e2-bc1f-53e914494b60,Gilang Katon Prasojo,https://play-lh.googleusercontent.com/a-/ALV-UjW6u993MjZm2ozZB4MhQI7bSyLR5OtnA2S4w0oY3cKtgQ,"Good job update.. jadi lebih keren untuk customnya kalo bisa stikernya bisa edit kayaknya F1 punya, lebih banyakin stiker sponsor juga... untuk helm nice sekarang bisa punya kayak pembalapnya..",4,0,3.0.24,2021-09-24 11:17:23,,,3.0.24
733,a5d0a942-68e2-4a37-8e9b-80ee90f0e9d2,medianto,https://play-lh.googleusercontent.com/a-/ALV-UjXpX3sYZPx6lNSdwYx2Iddvsl68SA7JLyCJ7vSfwMeKmlM,Sistem duel ny benerin lah... Spek mobil 700 point jangan dikasih lawan dengan spek mobil 1000... Sampe kiamat ga bakal kekejar... Minimal beda 100 point masih mending lah...,1,37,2.8.4,2021-08-03 06:54:24,,,2.8.4
734,ac251da4-87eb-482f-8d2f-b9961d23ef4f,Raup Zedan,https://play-lh.googleusercontent.com/a/ACg8ocIozQ7ZRmvCRXoNO-a99YDOP6-z5XD23NU5rDVVjIm3=mo,"gamenya bagus tapi kadang download tracknya lama bet, terus ada masalah handling kayak tiba tiba berat gitu terus tiba2 dibelokin, but overall the game is good, Ohya sama ketemu playerny biasany nyusahin",4,0,3.6.22,2022-06-28 08:20:17,,,3.6.22
