,reviewId,userName,userImage,content,score,thumbsUpCount,reviewCreatedVersion,at,replyContent,repliedAt,appVersion
254,8a3a256a-e9fb-4c43-b0c3-951cf4a453b7,Pengguna Google,https://play-lh.googleusercontent.com/EGemoI2NTXmTsBVtJqk8jxF9rh8ApRWfsIMQSt2uE4OcpQqbFu7f7NbTK05lx80nuSijCz7sc3a277R67g,"Yang mau punya sensasi lebih di arena jet darat download ini game.game racing rekomend banget menurut saya. Masukkan saya untuk ini game update nanti kedepan nya tambah kan fitur mode yg lebih banyak lagi dan harus ada penyesuaian grafik low, medium,dan ultra Hd. Di tunggu update terbaru nya.",5,1,,2019-08-20 20:08:45,,,
255,e4830eaa-12d5-412a-a1ff-6fca8f5c537c,Pengguna Google,https://play-lh.googleusercontent.com/EGemoI2NTXmTsBVtJqk8jxF9rh8ApRWfsIMQSt2uE4OcpQqbFu7f7NbTK05lx80nuSijCz7sc3a277R67g,"gamenya udah bagus,tapi kekurangannya pada saat Race Duel. mobil lawan udah terlempar luar lintasan tiba"" muncul lagi di lintasan. tidak ada pitstop. pada saat Race Grid start merasa tergangu dgn Mobil lain, pdahal cman 2 yg ikut Tanding.",3,5,1.12.6,2019-07-09 16:59:49,,,1.12.6
256,83eaeb55-a9cc-409f-9fa4-a9db5ca5b17c,Pengguna Google,https://play-lh.googleusercontent.com/EGemoI2NTXmTsBVtJqk8jxF9rh8ApRWfsIMQSt2uE4OcpQqbFu7f7NbTK05lx80nuSijCz7sc3a277R67g,Grafik bagus. Kontrol oke. Tapi ukuran besar dan tiap naik level download sirkuit baru dengan ukuran file yang lumayan besar juga. Update terakhir bikin banyak error. Tidak ada tombol keluar (haus tekan tombol menu di HP). Mode game kurang bervariasi. Akan sangat keren bila ada mode season atau career (apalagi bisa dimainkan offline).,3,45,1.9.20,2019-05-06 16:04:52,,,1.9.20
257,928394f9-bdbe-4d94-98eb-2a676d5bc420,Pengguna Google,https://play-lh.googleusercontent.com/EGemoI2NTXmTsBVtJqk8jxF9rh8ApRWfsIMQSt2uE4OcpQqbFu7f7NbTK05lx80nuSijCz7sc3a277R67g,"Sejauh ini oke gameplay menyenangkan, grafis bagus realistis, kontrol nyaman tapi sayang setelah balapan selesai tidak ada replay, saran saya kasih fitur replay seperti Real Racing 3 biar lebih keren, itu aja dulu terimakasih.",4,0,1.5.8,2019-02-05 03:11:14,,,1.5.8
258,d27029fd-c1fc-40e9-8894-d54d0f25697f,Bagas Rasya Adiputra,https://play-lh.googleusercontent.com/a-/ALV-UjWxJbqfd2vXyyLNqqcJ15_1U27G_xxUsdBbAeGkhGjNzxc,"mengecewakan sekali, dari sisi grafis yang sangat kurang realistis dan tidak bisa di setting sesuai preferensi player, gameplay dan story yang agak aneh. namun, ada sedikit kelebihan game ini adalah adanya pit lane yang dapat kita masuki, dan ada drs yang tidak ditawarkan di game f1 lainnya. tetap saja hal ini tidak dapat menutupi kekurangan game ini. semoga developer nya dapat mengembangkan dan meningkatkan game ini di masa yang akan datang. terima kasih",2,2,,2021-06-05 03:03:28,,,
259,521b0c91-d6fa-4b47-84df-4b83f1fa07b7,Alli Mustofa,https://play-lh.googleusercontent.com/a-/ALV-UjWzwGFRxqyI9oRUij9uV62uiQs571T86a8likMMfe51Kpvq,"Gamenya bagus, apa lagi grafiknya. Cuman corner cutnya terllu sering padahal cuman sedikit kluar track. Dan lwan kadanb kurang seimbag. Saat start bagian belakang di grid lawan di depan. Tlong di perbaiki lg.",2,20,3.3.14,2022-01-21 15:21:06,,,3.3.14
260,4a398d77-8a6f-4845-ab85-9309f5ee60da,Alvaa Renoo,https://play-lh.googleusercontent.com/a-/ALV-UjXmqxWirQZFyebstRjQwatB-6aAczfS-bBFchoRYonFHg,"lagi main malah reconnect terus,kalo iklan sih ya udh ya gpp ,anggap aja fee utk maen..cuma ini reconnect terus gmn cara ny main? jaringan normal2 aja,pakai game lain ping bagus lancar2 aja.. pdahal grafik sama efek sound game nya bagus,sayang server ny kek gtu.. gimana itu developer ny..ga di fix2",1,29,3.4.21,2022-03-13 01:14:42,,,3.4.21
261,0c7dffd1-b6f0-4ec1-af99-7077eb14d0e4,Fahri Gilang Mahardika,https://play-lh.googleusercontent.com/a-/ALV-UjXf4MyGJo1jJPRVQwDTxrK11I6Z1FZqD9wWTSSZBhqnEw,"Buat kalian yg gak bisa join mungkin bisa coba cara ini, kalian hapus cache gamenya nah terus masuk. Saya udh coba dan berhasil masuk lalu saya sudah selesaikan tutor dan juga bermain 1 match, tetapi ketika saya ingin bermain lagi tiba² Reconnect dan malah stuck lagi dilayar Loading. Udh saya coba Ngilangin hal yg sama tetep aja.",3,43,3.5.11,2022-03-24 10:38:40,,,3.5.11
262,4b7dc060-2a6b-475b-a043-210fe79d9c0b,wahyu aziiz (anjiiss),https://play-lh.googleusercontent.com/a-/ALV-UjXHXJ9fXLdbhD9l5e6PPtPnzD1bbPhd1-wrDVmrkz8xF5sM,"3 aja jaringannya gajelas, error mulu jadi males buat main",3,0,5.1.11,2023-07-29 14:53:22,,,5.1.11
263,8c87f9fa-b023-48b2-a9fc-9b2262094848,Pengguna Google,https://play-lh.googleusercontent.com/EGemoI2NTXmTsBVtJqk8jxF9rh8ApRWfsIMQSt2uE4OcpQqbFu7f7NbTK05lx80nuSijCz7sc3a277R67g,menguras emosi kadang sudah didepan ada kecelakaan layar jadi hitam padahal sudah menghindar dan dinyatakan DNF...untuk naik ke liga 3 susahnya minta ampun dah...tolong diperbaiki lagi...perfect start saja masih ketinggalan jauh padahal lawan levelx jauh dibawah,2,1,1.5.8,2019-01-11 17:54:41,,,1.5.8
264,a3fcff3d-2859-45ca-9d30-4a5406ee937e,XBOYツ,https://play-lh.googleusercontent.com/a-/ALV-UjXvm904qU2JQeFcKmOSw-PdqcohZrilnsORj3gk03ySL7c,Jaringan stabil susah banget masuk game nya,1,3,5.1.11,2023-08-15 11:17:11,,,5.1.11
265,a5ecebbf-a87d-4316-8f34-c9b4f32a304b,Jamal NKRI harga mati,https://play-lh.googleusercontent.com/a-/ALV-UjW4X7SCkR4wctTT8Lvm8q7RPfFw7wZd8N8n0pFj1ncn0A,"Pengalaman dalam menggunakan game ini selalu terjadi delay atau reconnecting,, namun hal ini menjadi permainan yg tidak nyaman karena selalu reconnecting, prihal jaringan yg di gunakan sudah maksimal dengan up to Mbps namun konektivitas jaringan ke server masih terbilang lamban ,untuk kelancaran harus memakai VPN seperti layak ny buka situs yg terblokir ,, untuk para developer harus memakai server yg bagus agar jaringan bisa terkoneksi ke server tanpa harus VPN ,, dan ini menjadi PR utk develop",1,23,4.0.48,2022-07-03 03:23:46,,,4.0.48
266,f39ee3d8-25f6-4063-be81-3c67c0b94856,bepeng ah,https://play-lh.googleusercontent.com/a-/ALV-UjWFZgJOlH33rezDtzhXn_poZEPEq5rhfFdAvcAJ7eIPemY,dari segi grafis sudah bagus bisa di tingkatkan lgi ada kurang nya suka ada bug dan di loading screen suka black screen stuck tolong di perbarui ini sudah bagus tinggal bug nya saja terimakasih,4,1,3.2.18,2021-12-10 04:31:28,,,3.2.18
267,97fc9b29-1436-4dab-9b88-140015e541c7,Teguh Stievano,https://play-lh.googleusercontent.com/a-/ALV-UjXo19JmusP33Mrt0iuYa_Kakn5npeBqKZurXVwXkbl_TYQ,Game udah bagus cuma sayang saat dirubah mode balap trutama cocpit pembalap malah grafik.y jadi jelek trutama bagian logo sponsor kliatan bgt pixel2.ny sama bayangan.y juga. Main carer / mode biasa gada seting mode tampilan kilometer yg lebih menarik dan bayangan serta pohon2 di kanan dan kiri harusnya jika saat Mode ERS/DRS activate bayanganya menyesuaikan kecepatan karena ada kenaikan tenaga dr mobil yg melesat lebih cepat Tong di BACA!!,1,8,4.3.19,2022-11-06 05:00:58,,,4.3.19
268,cbdc6d3f-db89-4cb9-b28b-e43cd99bc974,Wan Duke,https://play-lh.googleusercontent.com/a-/ALV-UjUIOpFALhFDroZBu-RITP_YUwPrWSsv3BwAx-H_KdMjpnc,"Bermain game ini sejak akhir 2016. Dan ini game F1 paling bagus yang pernah saya mainkan di ponsel, no doubt ! Tapi sejak update terakhir semuanya berubah total. Dari tampilan grafis yang lebih kasar, user interface menu dengan teks nya yang sangat kecil menjadikan semakin kurang informatif dan sulit dibaca oleh pemain. Juga ada beberapa bagian track yang terlalu gelap seperti di monaco dan baku. Tidak ada single mode sehingga player tidak bisa mencoba settingan mobil sebelum duel.",5,110,4.1.8,2022-08-09 15:39:38,,,4.1.8
269,495aa8a1-d693-4502-a9ca-6a8e8e69f312,Raihan Rabbani,https://play-lh.googleusercontent.com/a-/ALV-UjXCl1bXDC6BveVsE8Z850CluKb6VuDrThGi9v_g97U_YoA,"Untuk Grafik udah bagus, tetapi terkadang pas mau nyari musub pvp suka reconnect. Kalau bisa harga untuk upgrade mobil dikurangin sedikit atau tidak jumlah uang yg didapatkan setelag memenangkan race ditambah. Untuk Corner Cut terkadang ada beberapa sirkuit yg dimana saya masih menyetuh kerb namun malah mendapatkan Corner Cut. Sekian Terima Kasih🙏",4,14,4.3.19,2022-09-29 09:22:14,,,4.3.19
270,509f6fda-0424-4457-a327-6bba0fe76af5,embul 46,https://play-lh.googleusercontent.com/a-/ALV-UjVaMn2cJWoGaXqF-dsjkaxkxMiE7PdJpJexufr8IO7vEqA,"Sebenarnya bagus cuma 1 . cari uangnya susah buat repair mesin aja susah . Udah gitu gampang banget kena cut corners padahal cuma keluar sedikit bikin gap terlalu jauh sama musuh ,Sedangkan musuh"" sepertinya gak ada yg kena cut cornering .",3,4,4.1.8,2022-08-08 03:14:50,,,4.1.8
271,2d1d0b4e-c116-4431-9b58-2b73cf149f63,Rusdi Saleh,https://play-lh.googleusercontent.com/a-/ALV-UjXmfzqzz_ITeVB_bVvrJCtY7l-R8XQ94sTs_9YjR-lAB3s,tolong itu gimana kok saya download track baru kok 2 hari saya tunggu masih ga kemajuan ya?,2,0,5.2.47,2023-09-16 05:41:21,,,5.2.47
272,ef3dcb24-1385-40c4-a588-cf3539e33ee4,isa alfi,https://play-lh.googleusercontent.com/a-/ALV-UjVYirmmYCMTMLPFdKfT-HDuE_aIHbNdx4wNlIVY6Yp2LwcJ,"Grafik bagus, cuman fiturnya kurang banyak, dan setiap mau play pasti jaringan disconek reconek terus padahal pake wifi pake selulee sama aja, sering seperti itu, mudah2an ada perbaikan kedepanya",3,5,4.2.26,2022-09-25 01:13:05,,,4.2.26
273,2ff2003a-f285-4ba5-9c9b-2d5e58c9af27,Ricky Garangan Reborn's (Rifay667),https://play-lh.googleusercontent.com/a-/ALV-UjUlTDmZZyQ7w1d0fQhai9vdj8C3jHCvxdYcojG0LiH3gA,Reconet terus padahal sinyal bagus..untuk vermain game yg lain saja lancar sperti ML,1,3,5.0.39,2023-06-23 18:40:02,,,5.0.39
274,a9750bee-27fd-4524-8abb-84730c654527,Zkieraaa,https://play-lh.googleusercontent.com/a-/ALV-UjWcl9GC3bR0jyprj9cJN-LaHaBeqRTfOt9ZLMJzxcPavN8,"Bagus sih gamenya, Grafiknya keren, hampir setara dengan versi Pc/Konsol, tapi untuk mode career mohon quick-repairnya jangan di limit 2× perhari, karena Engine use terlalu banyak, bisa 20% tiap Qualif+Race.",2,20,4.2.26,2022-08-13 01:55:56,,,4.2.26
275,0176c655-2ad4-4a04-9240-58f9800fdc93,Dafara Ficky Fedriansya,https://play-lh.googleusercontent.com/a-/ALV-UjXhzmHA5eAvepyc-s0Sv-g5_1CUq1X-VEnND0vsdTDXBJI,Kelemahan game ini cuman pada tergantung signl untuk main coba diperbaiki lagi agar tidak terlalu tergantung pada signal saat bermain. Saran cuman untuk kenyamanan saat bermain semoga diperbaiki lagi. Overall semua bagus sih apalagi sensasi mainya seru. Tapi sayang yg mode MotoGP ngga ada,4,92,3.5.11,2022-03-21 09:14:49,,,3.5.11
276,64b3aba5-e811-4123-9880-4a1f1f6bcfe5,Pinanti Wulandari,https://play-lh.googleusercontent.com/a/ACg8ocImZF7XTwlREM2Ji7B4U9b40BvTMhWCOSOQS6d23dI6=mo,"Masih tetap sama,tidak ada perubahan,duel musuh keluar lintasan speed masih tetap tidak ada melambat,musuh tabrak tembok masih tetap dikecepatan tinggi.tolong dong diperbaiki.",4,265,3.3.14,2022-02-08 13:27:01,,,3.3.14
277,2e76f023-32c7-461e-939a-29bb540515d9,Bowo Bhijer,https://play-lh.googleusercontent.com/a/ACg8ocLfrEJwRO8F3NB8BTwljpCC0DJCMTszx4akfols0FEu=mo,mantap nih aplikasi game nya grafiknya juga mantap,5,3,5.1.11,2023-07-13 00:46:00,,,5.1.11
278,1e1db7f5-949e-4dbb-b540-868f1b1e5d38,FRANCIUS BUTARBUTAR,https://play-lh.googleusercontent.com/a/ACg8ocKAgNOMMkriYQownSA7KrAUplbC-4yKRxgeGnyBWP-Q=mo,Game ini bagus untuk segi tournament.. Tapi tolong untuk server nya jangan sering RECONNECT lah.... Masa udah pake wifi dengan kecepatan 25mbps aja bisa RECONNECT trus... MASIH NIAT BUAT GAME F1 INI BAGUS GAK SIH...?? tolong lah... Segera di perbaiki masalah itu.. Atau kalau gak bisa lagi buat bagus.. Biar langsung kami boikot ini game...,1,194,3.5.11,2022-03-17 18:06:04,,,3.5.11
279,80e30112-dade-4481-827d-8de0196bfccc,Enderman,https://play-lh.googleusercontent.com/a-/ALV-UjWDmLeo-lG-rQW3djs3CME5k9KXyQTBkQPWnLHXLX0ybQ,"dari segi grafik sangat bagus, kontrolnya bisa dibilang susah namun butuh adaptasi sedikit untuk bisa memainkan kontrolnya, overall bagus 😎👍 tapi saya kasih bintang 4 untuk memperbaiki kontrolnya",4,4,4.3.19,2022-10-02 03:10:52,,,4.3.19
280,907bcf95-48eb-41a0-992a-f15d1eb6b914,Pengguna Google,https://play-lh.googleusercontent.com/EGemoI2NTXmTsBVtJqk8jxF9rh8ApRWfsIMQSt2uE4OcpQqbFu7f7NbTK05lx80nuSijCz7sc3a277R67g,"bermain dalam mode duel (grid start) sangat sampah. walau sudah memulai start dengan perfect, tapi langsung melorot ke peringkat buncit. entah apa yang salah. tapi jika koneksi sangat buruk justru mode ini menjadi normal dan ideal. tolong di perbaiki mode grid start. saya sangat dirugikan dengan selalu kehilangan poin dalam mode ini.",1,5,1.5.8,2019-01-08 15:49:54,,,1.5.8
281,e91f76a4-2020-4f31-aca1-bdde45fae2f8,Amril Ashari Nosy,https://play-lh.googleusercontent.com/a-/ALV-UjWKXDEAm4G4HwIfDc21LTNStdLUK-kAlg_j5ZY-WjfN1Z4,"Gameplay seru dengan grafis nya keren udah mendekati seri PC, tidak ada kendala lah atau gangguan koneksi. He stabil sejauh ini, itemnya lumayan mahal tapi nggak apa lah bisa grinding juga.",5,0,,2022-01-26 09:00:38,,,
282,16107c36-a3d2-4531-8588-2896d3e9d056,Rindra Zildijian,https://play-lh.googleusercontent.com/a-/ALV-UjUzTvQzrpc1gDoUm6fpIDjxy-FVmAqLp3xtbSoEYjqX8Q,"Sebelum diupdate saya sering main game ini, menurut saya bagus, malah lebih bagus dulu dari pada sekarang meskipun waktu drs on spoiler gak open dan berhenti main lagi karna hp rusak dan sekarang download lagi udah beda banget, dari setup, mode game, sampai grafik yang udah lebih bagus dari sebelumnya tapi gameplaynya gak sebagus yang dulu.",1,0,,2022-01-21 11:57:41,,,
283,613aa350-b407-4d5a-a55b-3a3b8f966060,Dwii Febrii,https://play-lh.googleusercontent.com/a-/ALV-UjWwEcjT4YRfT2gTMDNa6TUHRFOrrxAJkeTJtR4iCWm3NBE,"Untuk gameplay nya udah bagus. Tapi saat bermain online selalu gagal online, pada saat ketemu lawan. buka bar notif sedikit langsung lost koneksi.. Tolong di perbaiki thanks",1,4,4.2.26,2022-09-20 14:26:35,,,4.2.26
284,5d2677b7-3022-47ec-a849-e05f6f64e981,suneater boo,https://play-lh.googleusercontent.com/a-/ALV-UjXjaRtb6ZrU-ey5U1RJoZeMXOq3YmKWPGjVYCMOceGrSA,tidak adil jika lawan duel memiliki spesifikasi mobil jauh lebih tinggi dibanding mobil saya. Bot dalam game terlalu kaku dan sering menjadi penyebab dnf baik saat duel maupun single. saya harap adanya komponen mobil yg lebih kompleks dan penyesuaian lawan duel serta pengembangan bot di versi game berikutnya bisa menjadikan game ini menjadi game balap terbaik seperti di ps,4,14,2.5.6,2020-11-02 04:25:55,,,2.5.6
285,e0bc7dbb-24e9-48c5-b382-f826071f6d7c,Pengguna Google,https://play-lh.googleusercontent.com/EGemoI2NTXmTsBVtJqk8jxF9rh8ApRWfsIMQSt2uE4OcpQqbFu7f7NbTK05lx80nuSijCz7sc3a277R67g,"Bagus...grafik,gameplay semau udh bagus...cuma kalo lagi main Quick race sirkuitnya fullin dong biar gk bosen..masa sirkuitnya cuma ada 4 doang tolong ya untuk CODEMASTERS ...Sama satu lagi sebelum main single race tolong diadakan qualikasi agar org yg bermain single race dengan difficult hard dapat mengamankan posisi ke-1",5,0,,2020-04-25 22:59:11,,,
286,02e6b59c-d929-496d-848e-4d794246ccb3,Drag Boz,https://play-lh.googleusercontent.com/a-/ALV-UjXCoxxpZcNdrnNA3Gi7njAHpgbp9YPdXgaYvlLcF2aW4Q,"Inimah developernya anak smk,game gk optimal,ngelag dan framedrop,ukuran terlalu besar,ngapain bikin grafik bagus tapi hp saya gak kuat?,mending grafik bagus tapi hp saya kuat,dan musuhnya juga gak adil,masa saya bisa kalah,biat game gini harisnya gampang buat kalian,ini memalukan",1,1,,2022-07-17 00:53:09,,,
287,8067a4cb-624b-4584-afa3-f22879fae400,Youtube_ Grt,https://play-lh.googleusercontent.com/a-/ALV-UjWDKtJBJQ75pM90nlI-s-WFcldpnMyLpGkHjoSjzyGHzho,Game terlalu sulit buat carer aja susah harus pvp tambah jaringan gk stabil parahh,1,4,5.0.39,2023-06-23 16:20:16,,,5.0.39
288,e948864b-3f4f-42fd-86f9-736706cb1fdf,Pengguna Google,https://play-lh.googleusercontent.com/EGemoI2NTXmTsBVtJqk8jxF9rh8ApRWfsIMQSt2uE4OcpQqbFu7f7NbTK05lx80nuSijCz7sc3a277R67g,"Setelah update ketika setir goyang sedikit tenaga turun,terlebih ketika ditikungan dalam posisi setir dibelokkan tenaga mobil turun banyak.kotrol setir menjadi sulit dikendalikan,lebih bagus sebelum update.tolong diperbaiki,juga tolong diperbaiki bug nya.lost conection ketika tidak menemukan lawan duel dalam waktu lama.terima kasih.",2,187,1.8.11,2019-03-18 17:20:08,,,1.8.11
289,0037a013-0585-4304-8034-5e2b390cd557,Bagus Pradana,https://play-lh.googleusercontent.com/a-/ALV-UjWemR63fxHUNd-xqKWYUIZE6KXdI_ZEJHekUog6uKK6LIc,"Dari semua lawan yang pernah saya lawan banyak lawan saya yang tidak masuk akal. Seperti rank yang berbeda jauh, win ratio yang berbeda jauh, serta mobil yang berbeda performa. Tolong di perbaiki untuk mencari lawan yang sesuai",1,12,4.0.48,2022-07-07 16:55:32,,,4.0.48
290,1f0ae6e3-7783-4c94-9eb3-a51f043ec31d,Anselmus Bskr,https://play-lh.googleusercontent.com/a-/ALV-UjXSI7f81MyvzqOlAOwvAyAo941HgAZo2qLOznXe6fisnwk,"Sejauh ini cukup bagus untuk grafis dan sebagainya, namun pada saat di career mode saya merasakan hal yang cukup aneh yaitu saat pembalap lain menabrak saya justru saya yang mendapatkan efeknya jadi itu memakan koin cukup banyak, tolong diperbaiki agar dapat menghemat di career mode",4,0,,2021-11-25 02:44:18,,,
291,02adcfff-8486-4886-a76e-f83c09001244,Nanda Herdiansyah,https://play-lh.googleusercontent.com/a-/ALV-UjVoLbWPJBRE-gsGEIzU6nOKD5dEoWci_mJvquXaaa3N464,"Game yang sangat bagus, sayang update terakhir membuat engine cepat rusak dan kita diminta terus menggunakan koin yg sangat susah kita dapat untuk membetulkan kerusakan engine, secara tidak langsung pemain dipaksa untuk mengeluarkan uang membeli koin di store. Microtransaction is fine, tapi game tidak lagi menarik untuk dimainkan ketika semua hal harus bergantung pada pembelian pemain.",2,1,,2021-12-20 01:03:32,,,
292,2825bd57-1be8-4f46-a032-bac459f66c9a,Pengguna Google,https://play-lh.googleusercontent.com/EGemoI2NTXmTsBVtJqk8jxF9rh8ApRWfsIMQSt2uE4OcpQqbFu7f7NbTK05lx80nuSijCz7sc3a277R67g,"Matchmaking nya tolong diperbaiki kembali, kadang lawan nya DNF tapi aku malah jadi ikut rugi, sehabis duel selesai ngga keluar Duel Won, muter muter terus sampai ngabisin baterai. Kalo di exit otomatis peringkat ku ikut turun. Buat control steering nya juga terlalu sensitif buat belok",2,56,1.15.6,2019-09-01 01:14:25,,,1.15.6
293,f7893e71-bf2d-4570-9725-b92c08010307,Chaidir Pratama,https://play-lh.googleusercontent.com/a-/ALV-UjVb6PA_eUvPckb0bcitLkLmRtPiFAt0ETU_Tye3uePlFZw,"Main game ini dari 2018, amat sangat bad sekali, banyak bug, error, dan kadanv token/koin ilang sendiri, cuman saya percaya bahwa game ini akan baik 2-3 tahun lagi, instal lagi 2021, sangat bagus sekali peningkatanya, grafik, dst sangatt jauh siginifikan, mohon tambahan bisa untuk pitstop, ganti ban, ada pentoton, kontrak, dat persis game F1 Yang PC. Bayar juga gpp, kalu emang wort it.",4,177,3.2.18,2021-11-26 15:22:50,,,3.2.18
294,29fa8ff5-ad10-4919-8a2f-602c03d685ea,Tukang Komen,https://play-lh.googleusercontent.com/a/ACg8ocIrtmryOBzG3Oc1V24aUiSvHEQC5WPAmrIg7aYQQ7E=mo,"Tolong damage mobil saat career mode dikurangi lah, masa tiap race + qualifying bersih tanpa senggolan kena 12-15% ? , dibeberapa track juga sering frame drop, padahal sinyal dan spek hp sudah mumpuni gak ada masalah + tambahin opsi lap saat career mode, bosen lah masa tiap race cuma 3 laps doang, jadi gabisa pake DRS + pit stop, kurang seru.",5,0,,2022-04-23 20:04:03,,,
295,fa0eacc2-017c-4db3-b59a-171ceb6b79fb,Iham Idoc,https://play-lh.googleusercontent.com/a-/ALV-UjWS4MeC4x8RBPAjH2eolZWIEj4_u3rdyaod74cYNvCdz3o,"gw kasih bintang dua dulu dah,menurut saya game ini keren,grafik bagus,tapi sayang pas kembali ada iklanya,tolong iklanya jangan Di tampilkan lagi,terus kalo ada mode championsip y wuh lebih keren,dan lebih seru,tolong Di perbaiki lagi,dan satu lagi mau milih sircuit tapi gak bisa,itu itu aja,jadi bosen dan jenuh..",2,108,2.4.2,2020-10-05 11:35:28,,,2.4.2
296,0437c636-d466-4607-b625-3d53efd1b8a4,Pengguna Google,https://play-lh.googleusercontent.com/EGemoI2NTXmTsBVtJqk8jxF9rh8ApRWfsIMQSt2uE4OcpQqbFu7f7NbTK05lx80nuSijCz7sc3a277R67g,"setelah update, tampilan semakin baik... namun saya tidak bisa join event... dan setelah membuka bonus pada iklan.. tidak ada penambahan nilai pada resources point dan credits saya.. sering reconnect padahal jaringan internet menggunakan wifi.. mohon diperbaiki..",2,6,1.9.20,2019-05-05 08:38:44,,,1.9.20
297,839c3fd5-ce73-41a2-9947-b7617f43ebbd,Gin Gin,https://play-lh.googleusercontent.com/a/ACg8ocJEyKerd7FnktALvKjDhiAalLMT06uhu7pj_evxGhQF=mo,Kualitas jelek banget ..masa iya kita pake wifi sinyal bagus rekonek melulu .dan trus baru bisa lanjut dari level satu ke satunya lagih ..harus terus2san keluar masuk mulu ... Tolong d perbaiki lagih ..jadi jangan terus harus pake kuota mulu .,2,11,4.4.43,2023-02-07 15:19:36,,,4.4.43
298,383155ec-e540-4ef0-b8c5-3ad8a12653a6,Pengguna Google,https://play-lh.googleusercontent.com/EGemoI2NTXmTsBVtJqk8jxF9rh8ApRWfsIMQSt2uE4OcpQqbFu7f7NbTK05lx80nuSijCz7sc3a277R67g,mohon maaf kalo saya boleh tau cara keluar dari gamenya gimana ya ? masa harus tekan tombol home gitu ? kasar bgt untuk game berukuran hampir 1GB lupa ngasih tombol exit 😔 terus ini kan game ukuran gede yah kenapa masih ada iklan ? yg jadi penyebab sebuah game jatuh itu salah satunya iklan yg sangat mengganggu dan menguras kuota.. cari cara lain agar developer mendapat uang bukan dengan iklan yg menunjukan ini seperti game murahan ! terima kasih..,2,193,1.14.0,2019-07-16 19:34:10,,,1.14.0
299,6efd269c-ab92-4563-ad94-692b9981b829,JUNO RFM,https://play-lh.googleusercontent.com/a-/ALV-UjXTVBGuVRyCfhfDBTMVaS_TuVH1psMyZFVQUM7XtEmOUKo,"Masih banyak kendala masalah seperti BUG, LAG, framerat FPS lemah, error & lain lain. Jenis mode kurang banyak. Track juga kurang banyak. Bonus game sedikit.",1,6,4.7.4,2023-05-09 13:28:23,,,4.7.4
300,65bd7db1-4b2a-4d24-bd93-0c78f8ef471d,Raihan 21spt,https://play-lh.googleusercontent.com/a/ACg8ocLJzwJ-nKbbdkZn7b-rHW2sIB-K5jHDoRmFTJGJTBZX=mo,"untuk keseluruhan lumayan bagus, dari kontrolnya dan grafik tapi ditambahkan dong untuk fitur multiplayer atau bermain bersama teman, soalnya ini game juga online jadi rugi gabisa ketemu player lain atau teman",4,5,4.7.4,2023-05-12 23:44:43,,,4.7.4
301,a6035732-b813-42cd-ad0c-ce4438d5fb98,Bintang Luhung,https://play-lh.googleusercontent.com/a-/ALV-UjWaTo5xdCymxSFxb5RbEHbbtL3GvS9GSI5nm5X8kCtsqw,"Untuk permainan sudah bagus,tapi tolong tambahkan mode quick race seperti di konsol dan PC,di game game lain saja ada quick race,kenapa di game aslinya tidak ada?,dan tambahkan untuk bisa masuk pit lane",3,0,,2023-05-14 03:30:08,,,
302,a1ee491f-c9a6-4325-b9e7-c36e65ee9256,xĐƦiaиz.,https://play-lh.googleusercontent.com/a-/ALV-UjWaANEsUAL0zgibjPut80G0jF_LgfDLI7H0S_o7Er5D3Kw,"sangat tidak adil,disaat kita keluar lintasan otomatis mobil langsung pelan,tapi mobil musuh yang keluar lintasan masih melaju cepat..dan tolong kasih lawan yang seimbang,terimakasih.",2,8,4.1.8,2022-07-13 22:20:50,,,4.1.8
303,fcb8eb80-346c-48fa-a264-004f683ff45b,Theogiven Kadang,https://play-lh.googleusercontent.com/a/ACg8ocJ_wip-M-0PIibnCd-CtiFJr8W3PLBcT9YE1LbKw0X0=mo,"Setiap kali menang pasti reconnect Mulu jadinya kaga dapet poin, giliran kalah pasti ga reconnect. Untuk developer mohon untuk menyelesaikan permasalahan ini dengan secepat mungkin",2,0,,2023-05-23 12:28:34,,,
304,d8acc346-969b-4790-8d0a-600b477ef6ab,32_Zidni Nafan,https://play-lh.googleusercontent.com/a/ACg8ocL8SZ2PX-IYHEXA_Ed3FiW7GdUMLRBwjKyh1mSQOM32=mo,Setiap saya mau main ko Reconect terus dan kenapa setiap main ketemu player yang tidak setara setidak nya tidak jauh jauh banget saya ketemu dengan player legue 1 sedangkan saya masih legue 5 terus kenapa setiap balapan yang duel koin yang kita dapet hanya 30 sedangkan keperluan koin sangat banyak untuk upgrade mobil saya suka dengan grafik dari game ini cuma itu saja yang harus di benarkan 😁,4,15,4.7.4,2023-04-12 02:20:29,,,4.7.4
305,b5228a94-b5dc-45f9-a7bb-01709cfe3600,Danny Ramdhan,https://play-lh.googleusercontent.com/a-/ALV-UjUEO-iEfBP34LpoZFYtzyBXL1bCTlcwu-hvVo7swtqFkG0,"Gamenya bagus, Gameplay seru, Grafis nya mntap. Hnya sja sring reconnected pdhal sinyal sangat bagus.untuk mndapatkan gold & koin sangat sulit.Ktika main mode duel sangat sring bertemu lawan yg tidak seimbang level lawan terlalu tinggi,musuh tdk terkena penalty saat memotong jalan dan sngaja mnabrak lawan.Dan yg terakhir Adain replay, bnyak bug di event kita sudah jadi yang nomor satu tapi reward nya tdk dapat semua. Stelah update jadi loading tros server Eror udah bberapa Miggu gua gk bsa main",3,70,4.2.26,2023-05-08 13:41:06,,,4.2.26
306,3fa3dd87-c7b7-4400-a380-e0c8c78920de,Nobyz 08,https://play-lh.googleusercontent.com/a-/ALV-UjVjHYFppgwdBYYxF0W7kIImJEt7WpUczMLATKuxy2unWLw,"sistem league terlalu susah untuk dimainkan, mobil tidak sebanding dengan lawan, terkadang juga ada lawan yang keluar dari jalur tapi tidak melambat, apakah nampak realistis? sangat buruk sekali untuk versi ini",1,6,4.7.4,2023-04-26 18:24:22,,,4.7.4
307,f30e7654-aed8-4c70-8a2d-f4a088184ccc,TEGUH AJA,https://play-lh.googleusercontent.com/a/ACg8ocKqgzrN9gaHlXW5lWjvqG1_YeRzABD6byxoRnvHf-xR=mo,Jangan donwload apk game ini soal ny saya sudah coba tapi banyaj bug nya seperti tidak bisa tap tap layar pas mau buka boks nya dan juga jaringan saya udah 2 lo di pakai wifi sama data internet masih aja lag dan game nya sering patah patah dan crash nya juga ngak masuk akal jadi jgn donwload cuman habisin paket aj ama ram hp kalian bagusan game sebelah meskipun penyimpanan nya ngak sampai 1 gb masih bagus juga oke tanks untuk gane ini saya aja baru donwload lansung hapus karna banyak bug nya,1,0,,2023-07-03 10:17:54,,,
308,ce9a9062-6ca0-4d34-b27a-8b73504cebdc,Team Bebek Jahat,https://play-lh.googleusercontent.com/a-/ALV-UjV84hXHcbeytEwynZgw_zuapn4v256b30ZtzFK1m3I5rl0,"segi tampilan game ini udah bagus ya tapi sayang bangett sinyal di game ini tu harus bener bener stabil , klo ga stabil fail , mau login aja fail ga bisa masuk ,jadi ya mau gimana lagi terpaksa UNINSTAL",5,0,2.7.6,2023-07-05 14:31:28,,,2.7.6
