,reviewId,userName,userImage,content,score,thumbsUpCount,reviewCreatedVersion,at,replyContent,repliedAt,appVersion
479,f1eda03b-4181-4f88-8a6f-9db5dc518843,Pengguna Google,https://play-lh.googleusercontent.com/EGemoI2NTXmTsBVtJqk8jxF9rh8ApRWfsIMQSt2uE4OcpQqbFu7f7NbTK05lx80nuSijCz7sc3a277R67g,"5 alasan saya beri 5 star, 1.graphic hmpir kayak consol 2.super smooth wlaupun graphic hampir realistic 3.sound car super realistic 4.codemasters emang oke kalo produksi game 5.gratis (jrng2 game bagus dikasih gratis) -------- pesan : 1.lebih maximalkan lg graphic nya 2. klo bisa ada shadow jlas, ada hujan, efek kilau matahari,,",5,78,1.5.8,2018-12-20 04:58:30,,,1.5.8
480,e420ef94-648e-4a9d-9786-f46f51463477,Rama I Bagus,https://play-lh.googleusercontent.com/a-/ALV-UjUhr1AIHfEO4lsMUp5CWNMpUSIojoBtA_8wU8NRrkh_oh0,"Soal grafik oke banget, tapi masalah saat duel dengan lawan tetap saja ada yaitu ketika lawan keluar trek atau melakukan corner cut mobilnya tidak melambat, tapi jika saya yang melakukan hal itu maka mobil saya melambat.",4,2,4.1.8,2022-07-25 06:32:59,,,4.1.8
481,cfd6b45e-b094-4cb2-946d-0033a6058628,Aldhi Ramadhan,https://play-lh.googleusercontent.com/a/ACg8ocKy3Kkh1a64LG7NCnJdBKEuIp8GF5FdCV9Y-aYbD_ca=mo,Game nya sudah bagus. Tapi mohon dibantu untuk tokens nya biar lebih mudah didapatkan karena untuk upgrade sparepart butuh banyak sekali tokens nya mohon dibantu untuk mendapatkan tokens biar lebih enak mainnya,5,12,4.6.17,2023-03-21 05:17:13,,,4.6.17
482,b69fdf46-39e9-4a32-86a8-c5f67ee052ad,Pengguna Google,https://play-lh.googleusercontent.com/EGemoI2NTXmTsBVtJqk8jxF9rh8ApRWfsIMQSt2uE4OcpQqbFu7f7NbTK05lx80nuSijCz7sc3a277R67g,"gamenya kurang di tingkatkan terutama pada banyaknya mode permainan seperti membangun tim dari 0%,kemudian grafiknya ditingkatkan,baru aku kasih bintang5",3,0,1.5.8,2019-02-15 09:23:55,,,1.5.8
483,1584adec-eaa9-48ba-b970-53d4101d0e83,Pengguna Google,https://play-lh.googleusercontent.com/EGemoI2NTXmTsBVtJqk8jxF9rh8ApRWfsIMQSt2uE4OcpQqbFu7f7NbTK05lx80nuSijCz7sc3a277R67g,"banyak yang bilang grafik nya bagus, tapi buat saya RR3 lebih baik. terutama sirkuit spa Francorchamps, kerb nya aneh bgt disini, dan beberapa bagian masih kasar banget. tapi overall bagus, karena game ini bener2 ngasih feel ke kita gimana rasabya jadi pembalap",4,24,1.15.6,2019-09-06 15:14:00,,,1.15.6
484,f2b94d6a-af8d-48d5-953e-8022d0e7884f,Maulana Satriyo W,https://play-lh.googleusercontent.com/a-/ALV-UjWEtRTLAKqoXqAI5tVVd2Bc3F724U7rlrVlI9pgHwmYEnU,Sangat suka! I really enjoyed this game thanks!apa susahnya ini game bener² enjoy banget gua aja udah bukak track Monaco dan bagi yang masih belum tau rem nya bisa di edit sendiri ke low medium atau ke high.Kalo buat pemula racing f1 ya high aja.Sumpah gak nyesel. Thanks code:),5,17,2.2.2,2020-08-30 02:08:30,,,2.2.2
485,3ea8b73e-c2d0-40e1-bce9-1e00994f79ae,Pengguna Google,https://play-lh.googleusercontent.com/EGemoI2NTXmTsBVtJqk8jxF9rh8ApRWfsIMQSt2uE4OcpQqbFu7f7NbTK05lx80nuSijCz7sc3a277R67g,"menurut saya game ini sangat memuaskan untuk game gratisan, cuma stlh update mnrut saya ada sdkit patah2, dan juga klo bisa di kasih map trek soal ny tdk mngkin player bisa menghapal semua trek yg ada.. terima kasih bnyk atas game ny",5,211,1.8.17,2019-03-27 15:09:27,,,1.8.17
486,5c98a23a-dce3-4628-8a42-6511194fb2f6,Ferri Ven,https://play-lh.googleusercontent.com/a/ACg8ocJ8RQCLVNqG_oWB7QHsNHkN64Cqybe36JnVuiFxr_YM=mo,"Game nya bagus gratis mantap,cuman agak kesel aja sama sinyalnya,suka putus sendiri Padahal sinyal sini bagus banget Mohon di perbaiki agar lebih enak untuk di mainkan Setelah update game tidak dapat di bukan Sinyal bagus padahal,tolong di perbaiki kembali game nya udah update malah makin jelek",5,0,4.2.17,2022-08-10 09:46:46,,,4.2.17
487,fb7c5655-2cc5-4c8c-848f-c79cf5c8bf89,Dylan Ramadhan,https://play-lh.googleusercontent.com/a/ACg8ocIXuj3MuPoTziGuHoZkrXpIy6KFv8HEtVUagI93eIx2=mo,Tolong sangat pengembang semoga bisa ada mode bermain sendiri membuka mode pembawa sangat lah susah karena poin yang banyak dan susah untuk didapatkan,5,4,3.4.21,2022-02-28 17:38:13,,,3.4.21
488,2668bf36-9f6d-408c-aee9-a95535d2ba8d,Pengguna Google,https://play-lh.googleusercontent.com/EGemoI2NTXmTsBVtJqk8jxF9rh8ApRWfsIMQSt2uE4OcpQqbFu7f7NbTK05lx80nuSijCz7sc3a277R67g,"Harusnya kalau sudah membuka WA atau yang lain di jendela mengapung jangan terpengaruh, malah reconnect.. cuma itu kelemahan nya.. mudah sekali reconnect",4,10,1.22.8,2020-03-21 22:12:44,,,1.22.8
489,aa6e7504-831b-4443-85e9-b3080680b023,Ghilman Naufal,https://play-lh.googleusercontent.com/a/ACg8ocIb9djdQ1jZns6DuO2Kydznwef35UcLHHReJufkKa3sww=mo,"Game nya sudah baik untuk android, hanya kurang pitstop, full laps, grafik sudah pas untuk game android, mohon kedepanya ditambah lagi update mobil baru",5,4,2.2.2,2020-07-22 07:09:27,,,2.2.2
490,37519650-e5d9-4396-8f1e-d6713a6e3199,Ab Dil,https://play-lh.googleusercontent.com/a/ACg8ocJ3fIKBZA9syyPbl-txDNjYffuEFAz_sjWujWZF9qD_=mo,Kenapa sih ini game selalu gangguan dengan jaringannya. padahal jaringan HP bagus.. tolonglah. perbaiki ini game. supaya enak mainnya. saat kita mau star balapan. eh.. gangguan jaringannya.. padahal ini game sudah sangat bagus.... dan knp saya sekarang susah masuk digame.?,1,29,1.22.8,2020-05-17 18:07:09,,,1.22.8
491,baa2b63d-a562-4887-b6ee-45ff7fde11fe,Moch. Aydin Al Rafif,https://play-lh.googleusercontent.com/a-/ALV-UjUYONGVzJBQbx_77sCugccxw0AT-CXzeagXl-FtlimlG54,"Jelek, di carer masak cepet rusak padahal saya usahain tidak nabrak, di sebelumnya sebelum update g ada masalah setelah update masalah di gewe carer sebelah kiri bawah cepet habis dan ga bisa main terlalu sering harus nunggu besok kalau mau diperbaiki karena ada waktunya kalau tidak bisa pakai yang lain tapi lama kelamaan cepat habis",1,0,,2022-01-29 02:57:23,,,
492,fccabde3-790f-4c6c-8821-bdc93548a6e9,Mohamad Eko Prasetyo,https://play-lh.googleusercontent.com/a-/ALV-UjXvBJ0QNTP5aKnIKApMN2IKJhc5CSe3Nu0ZfPA31zJaq-Q,"Kontrol susah, settingan grafis tidak bisa di ubah sesuai kebutuhan, upgrade kerusakan kendaraan mode career sangat lama",3,0,4.1.8,2022-08-09 15:09:39,,,4.1.8
493,132e6e86-7b0d-4acd-943d-eb137a98fe48,ibnu amjad,https://play-lh.googleusercontent.com/a-/ALV-UjUiowk0ITw3hfERlPFlOBQcSKXIU5XO8yBr4PgacM6v9xI,"Saya pecinta F1 dan saya senang main game ini, tapi kenapa masih banyak sekali bug nya, coba dibuat lebih realistik lagi seharusnya, lalu kalau tidak ada inovasi game ini boring banget, bgtu bgtu aja, kapan kita bisa pitstop nya",2,3,3.6.20,2022-04-22 23:19:41,,,3.6.20
494,f6a6c571-6cdf-4d6b-ac2b-c8773e71482b,Geovani R,https://play-lh.googleusercontent.com/a-/ALV-UjWTkztesPv39WEZFcNaAO7kSntGY71PJp6XEZJikj9-DYI,"Suka reconnecting, padahal koneksi sangat stabil, dan bagus banget tp malah reconnecting ga pake WiFi, data sama aja suka reconnecting",1,1,4.3.19,2022-10-17 11:54:05,,,4.3.19
495,e1a17af9-21ea-4186-a208-e8f0d6781639,Sebastian Wijokongko,https://play-lh.googleusercontent.com/a-/ALV-UjU0hnuAFjeG2k1kFFSKFskeBVG6hN485OyzgeQEa4MYXA,Game nya gak bisa di mainin nytak Di loding screen awal sama pengalaman saya yang kurang baik Seperti lawan saat duel lawan lebih kencang dan level lawan juga besar besar dan kalau mau beli mobil baru juga mahal seperti CR dalam game yang harus di beli pakai uang asli dan padahal itu uang dalam game untuk membeli kalau mau beli tanpa CR pakai uang asli mohon CR dalam game bisa di dapatkan setelah race,1,8,3.0.26,2021-10-09 12:12:29,,,3.0.26
496,35feff6e-bb74-48cc-9375-d535dee9c07b,NIKOLA AlEnSiO.p,https://play-lh.googleusercontent.com/a-/ALV-UjVnkTgb1fnfSN8cwZxHBJU10Q2uXAljaEOoNFETsFxK_yk,"Sudah bagus dari pada saat awal rilis tapi ada beberapa kesalahan yg cukup mengganggu, dan tolong di tambahin mode latihan ubtuk membantu menghafal track, saya belum hafal di beberapa sirkuit seperti monaco yg susah di di hafal sehingga membutuhkan latihan untuk mahir",5,0,4.2.26,2022-09-15 00:33:36,,,4.2.26
497,7d473e9d-51f9-4c22-bd36-910c76ec84c2,Sukinah Rawalo,https://play-lh.googleusercontent.com/a/ACg8ocIb8-9c5hha4ckOFYJHOsjkSRG5HkdSbeuR3CXlmgM=mo,"Untuk grafik udah bagus dan fitur-fitur lainnya juga udah bagus udah mantap,tapi disayangkan jaringan yang suka reconnect sendiri padahal jaringan saya udah bagus untuk itu tolong kedepannya diperbaiki",4,2,4.3.19,2023-01-04 15:06:13,,,4.3.19
498,3b16ca22-279c-4745-9864-b7315e3dffde,Lode Running,https://play-lh.googleusercontent.com/a-/ALV-UjWPzkSNNqU8rLB3vhcQec5sRKNQZ8wUen9Jx-_iUidhbQk,"Uninstal. 1. Balapan nya cuma 2 player doang,yg lainnya bot 2. Lapnya cuma 1 doang pas balapan 3. Mobilnya mahal"". 4. Sering lost conection padahal signal gw bagus. Diperbaiki lagi kalo ingin laku. Maaf gw unintal lagi.",2,1,,2020-05-28 01:29:24,,,
499,c629a6b1-79bc-488e-aa5e-ff259fe8173e,Pengguna Google,https://play-lh.googleusercontent.com/EGemoI2NTXmTsBVtJqk8jxF9rh8ApRWfsIMQSt2uE4OcpQqbFu7f7NbTK05lx80nuSijCz7sc3a277R67g,"Server terlalu berat. Saat race dimulai dan koneksi terputus, race tidak bisa diulang dan berakhir dengan kekalahan seharusnya race diulang biar adil. Mohon diperbaiki.",1,0,,2019-11-16 15:00:36,,,
500,e1db9d35-eac8-4c5d-9563-8c8fbebb4523,Muhammad Riyan Prasetya,https://play-lh.googleusercontent.com/a/ACg8ocKYelLyVl1eQPXSnEdm_Pv2Q4hYRSlNLiUjbtEoyCDz=mo,"Game kurang baik! Selalu dipertemukan dengan lawan yang tidak sebanding dengan kemampuan milik kita, dan juga ketika lawan keluar jalur mereka tetap kencang sedangkan milik kita keluar jalur melambat ini sangat tidak menyenangkan.",1,0,,2022-05-26 12:47:26,,,
501,5b9a9f72-717d-4314-afe5-a3613f15bcfd,Fazri Nuridwan,https://play-lh.googleusercontent.com/a-/ALV-UjUrMYVAyfEuuzzmVKseC-XvIke-QUuRC2Z9BFR7prnNS74,"Saya sangat suka game ini,grafik yg bagus dan gameplay nya juga tidak terlalu sulit Saya harap buat pendapatan koin lebih diperbanyak lagi dari hasil duel ataupun event nya,dan untuk mode duel tolong diperbaiki lagi agar bisa bertemu nya dengan level yg sebanding Terimakasih Love this game🤗",5,9,4.5.12,2023-02-15 16:40:30,,,4.5.12
502,2eab917e-3d0a-41fd-8ba4-fb8cdf88d1c0,Asan Ali Purwadi,https://play-lh.googleusercontent.com/a-/ALV-UjXNyKzfXRrM9rKu5NdLkrg3TFObkofiRC3ZPMwv_5etqyw,"Hal yang perlu ditambahkan untuk update selanjutnya : 1. Penalti, 2. Multiplayer mode with LAN WiFi, 2. Front wing damage effect Terima kasih",5,2,,2021-07-27 00:56:53,,,
503,c84012be-8be6-4ee6-b6f6-a5a9286493dd,nugie putra,https://play-lh.googleusercontent.com/a/ACg8ocIpNuTKzxuaBD64OAcsHMNeEtucmopupanT5bcY4-KU=mo,"Hai devloper tercinta. Apa kalian sudah coba sendiri game nya ?? Bagai mana ?? Musuh keluar jalur kecepatan normal2 saja tanpa hambatan. Kita keluar jalur auto engine breake, lalu apa hukuman lawan yg agresiv contact ? Sering kali lawan nabrakin mobil nya tapi kecepatan nya normal normal saja! Tolong fix it . Ini bukan game 200mb",1,7,2.2.2,2020-09-08 14:09:56,,,2.2.2
504,cb1ae659-9bb2-4d8d-9cca-3799e5cc2b1a,Raihan Ekaputra Giffarinda,https://play-lh.googleusercontent.com/a/ACg8ocIjZJf7WVx0axfgaRvTRU7FuYFoTRDoeRyrERKSDHTk=mo,Fixed bug please. Reward koin tidak seimbang dengan harga upgrade. Tidak ada mode quick race seperti dulu.,1,4,3.5.11,2022-04-22 16:28:38,,,3.5.11
505,2ba795fa-3f9c-445a-9975-d48e617bdeef,Pengguna Google,https://play-lh.googleusercontent.com/EGemoI2NTXmTsBVtJqk8jxF9rh8ApRWfsIMQSt2uE4OcpQqbFu7f7NbTK05lx80nuSijCz7sc3a277R67g,"overall sudah bagus , mungkin untuk next updated nya ada pitstop , ada berbagai cuaca dan untuk ban bisa diganti ganti .. dan ada penaltynya juga . goodjob",4,5,1.7.3,2019-03-07 15:57:59,,,1.7.3
506,69de254e-bfa0-46f5-99f7-42cc55b25d4a,Suryanto Tzy,https://play-lh.googleusercontent.com/a-/ALV-UjUBVQ4mQBgGAR79bG0hwNFwPIpQvS-Ud-I9qkV20S7-sZg,"Kecewa berat gua ama ni game, awal2 mode game yg bisa ngecreate mode itu diilangin abis itu diubah jdi career mode, dh gitu career modenya ga jelas lagi, trus sering banget reconnecting pas lg buka bar notifikasi",1,119,4.3.19,2022-12-19 10:41:31,,,4.3.19
507,1f9e0a36-38ba-423a-bdb6-3d5d9867cdf8,Kimihatchy Erkan Hendarsyah,https://play-lh.googleusercontent.com/a-/ALV-UjXIlejhduHQAloxziq1nDh7A8snm0S4LrnY0_HkQytT2Vw,"adain quick race mode/exhibition mode dong di next update, jadi bisa ngerasain berbagai macam mobil tanpa bisa di update, dan cuma orian doang, oh iya sama wear in career modenya di ilangin aja tuh, gaguna",1,15,3.3.14,2022-01-15 17:24:54,,,3.3.14
508,f980c339-b0f7-4728-8c5b-a4d2bb296335,Tayo Taufik N,https://play-lh.googleusercontent.com/a-/ALV-UjVsUKhwPLxVBxqqHtWaFiu_H2JFpbExxPQnIhjSkgBltnc,"Aplikasinya jelek,giliran mau download All sirkuit malah nggak bisa ,padahal pake wifi. Giliran di pakai di aplikasi lain sinyalnya lancar lancar aja",1,2,3.6.22,2022-05-23 14:47:47,,,3.6.22
509,66ebbd62-5667-4c22-bac1-20265bf9e8b0,Muhamad oji Saputra,https://play-lh.googleusercontent.com/a-/ALV-UjXfOldvxszYhuNY4y4pxfXfzO0VrohE89lxXVS1Icnjlg,keluhan doank sih semakin sering main sering gagal untuk masuk dalam permaianan (eror) jadi menghambat untuk bermain.jadi tolong di perbaiki server yang bermasalah kalopun itu emang harus di update ya update ajah. insyaallah gamenya bakal rame.tolong di respon dan di tindak lanjuti ya.makasih,4,0,4.2.26,2022-09-22 18:59:48,,,4.2.26
510,6a51c34a-4ccd-468d-940a-7b457346d7a1,Lutfi Setiawan,https://play-lh.googleusercontent.com/a/ACg8ocInKw4PjG-mLsg8koMeP59mVUqkZiIDXx-KsUZIMBN8=mo,Game yang lumayan bagus.. dan grafis lumayan ok.. selanjutnya tingkatkan terus game ini agar semakin bagus dari segi grafis maupun gameplaynya..,4,17,2.5.6,2020-10-20 19:47:59,,,2.5.6
511,dd8190b2-1023-4ddf-a9e7-669984f48767,Sketzu 69,https://play-lh.googleusercontent.com/a-/ALV-UjVfZWcFaITI5KSOizZEdS6ozheO4p5FK735ckICZDs79A,"Hai Developer Saya Tidak Tau Mengapa Saya Mengalami Stuck Saat Mendownload Map, Sehingga Saya Tidak Bisa Memainkan Game Ini Lagi. Tolong Diperbaiki Bug Itu. Saya Suka GameNya Tetapi Jika Saya Tidak Mendownload Map Bagaimana Saya MemainkanNya?",2,15,3.1.5,2021-11-04 09:28:20,"Hello, we're sorry that you've experienced issues. Could you please use the ""Help & Support"" function in the game, and give us more details about the problem you're facing?",2021-11-05 15:42:35,3.1.5
512,27210eba-b948-42cf-99d6-b1c8e882b847,rizkyramadhan,https://play-lh.googleusercontent.com/a-/ALV-UjWRPC8dDL_nD6WiH7stj-CFn1L6wdR6daMDinoDkUiE48Va,"Dari segi grafik udah oke, cuman dari segi gameplay kurang smooth, dan network masih reconnect (padahal udah pakai wifi kencang)",3,0,,2023-03-22 17:22:48,,,
513,1b79750d-57e9-4296-adef-4a93bfef4574,Pengguna Google,https://play-lh.googleusercontent.com/EGemoI2NTXmTsBVtJqk8jxF9rh8ApRWfsIMQSt2uE4OcpQqbFu7f7NbTK05lx80nuSijCz7sc3a277R67g,"Gameplay bagus, control bagus, grafik bagus, tapi yg buat saya kecewa yaitu setiap saya ingin duel itu selalu reconect jaringan setiap saya ingin duel selalu seperti itu padahal jaringan Ok, hp saya pun speknya bagus saya menggunakan HP Xiaomi note 8 tetapi kenapa selalu reconect???",2,45,1.22.8,2020-04-15 08:05:35,,,1.22.8
514,622c6fab-b3d3-403c-be8e-694d92cdc852,Praditya Rafito,https://play-lh.googleusercontent.com/a-/ALV-UjXl8rI85dO4GPIwoHzYLiu4-lhWdcXZr30sIyZj18swHQ,"Untuk update kali ini tolong di benerin pas duel nya, masa pas lawan menyentuh rumput mobil nya masih aja jalan cepat, sementara mobil saya yg terkena rumput jdi otomatis melambat.. tolong ya untuk update selanjutnya di bagusin lagi🙏🏻🙏🏻",3,3,3.5.11,2022-04-13 07:36:29,,,3.5.11
515,63986e80-5ac9-4446-8588-a1733fd92764,Pengguna Google,https://play-lh.googleusercontent.com/EGemoI2NTXmTsBVtJqk8jxF9rh8ApRWfsIMQSt2uE4OcpQqbFu7f7NbTK05lx80nuSijCz7sc3a277R67g,"poin sering berkurang gara2 reconnection, musuh duel kadang mudah kadang susah..saat start sprint kadang waktu kita langsung unggul jauh....settingan part tdk ada pengaruhnya... lose or win in a duel set by the server",5,8,1.8.17,2019-04-19 17:02:15,,,1.8.17
516,89662772-ed9a-4aa8-a933-be7731ba5c1a,Ali Al mualifin,https://play-lh.googleusercontent.com/a-/ALV-UjXEUuL85WkDAEeWwpHJk1mtlM9uIbOC9AVVLO5xuydl4xw,"Game nya kenapa kadang lancar juga sering banget lag sendiri, setiap kali mau main pasti ada patah patah terus kaya 1 match aja ngga pernah lancar dan juga sinyal bagus tapi coneting terus",3,1,3.6.22,2022-04-26 22:02:09,,,3.6.22
517,38889d90-4ecf-4b6c-92a4-1d88e6e3768d,Pengguna Google,https://play-lh.googleusercontent.com/EGemoI2NTXmTsBVtJqk8jxF9rh8ApRWfsIMQSt2uE4OcpQqbFu7f7NbTK05lx80nuSijCz7sc3a277R67g,"Game ini sangat bagus, tapi masih ada yang kurang seperti mode grand Prix dan bisa masuk pit, ohh ya masalah ban juga sekarang ban kan ada banyak tipe nya seperti supersoft kalo bisa fitur ganti ban dan mode hujan udah itu aja mksih",5,3,1.11.3,2019-06-26 14:06:58,,,1.11.3
518,59db6bb6-8d6a-4915-9d85-c72efa00895e,TITISAN PANDAWA,https://play-lh.googleusercontent.com/a-/ALV-UjWI_yb9Kp7m_khF8nkBQ1YPVqLW6VFwj1HW6eVI6KPxoFUm,"Sebenarnya, Game ini bagus, tp entah kenapa sring reconnect berujung gagal, pdhal ukuran data game dan file nya lebih kecil dr pada asphalt 9, lbih kecil lg dr Mobile Legend, yang dimana ke 2 game tsb brjalan adem ayem bin tentrem di Hp saya. Mohon ditinjau lg untuk developer EA Games. Supaya jd lbih baik gamenya dan bisa dinikmati pengguna yg lain scara meluas.",2,1,,2022-06-07 09:14:54,,,
519,83ae620a-e3b8-4e94-992c-5189df821584,Fade47 Gaming,https://play-lh.googleusercontent.com/a-/ALV-UjW6Su8mKdzr1oTt66NLSwMNoTcKg2sgASGIhrb5pU9DrQ,"Grafik gameplay sudah bagus hanya saja kita hanya balapan 3 lap saja dan tidak bisa melakukan pit stop , buat full lap dan pitstop agar semakin menarik thanks tolong di wujudkan yah",4,2,4.3.19,2022-10-11 00:50:02,,,4.3.19
520,77179ff4-7afc-4a3f-9c95-8782097de591,Ataya Nabil,https://play-lh.googleusercontent.com/a-/ALV-UjVxjBbQbidcoGgPtzRs4Laezr4ehSPsLLkunsC5Tqkn7Rw,Gameplay udh seru. Tpi gk bisa ad apk lain yg jalan. Kayak misalny main ambil discord-an atau dngr lagu sambil main ni game. Dan kdang eror klau mau download map lama bngt pdhal sinyal dh bgus. Dan tlong tambahan fitur training mode,4,1,3.6.22,2022-04-27 13:51:09,,,3.6.22
521,eff8cd4e-2a47-4b72-804c-33273ec23fb9,Muhammad Taufik Ramadhan,https://play-lh.googleusercontent.com/a-/ALV-UjWRXbagxGV2GeAitsn6dlbn8X_c9NDCW6VtoHOerNeHiA8,"Saya sudah lama tidak memainkan game ini. ketika saya ingin memainkannya kembali dan login seperti biasa,Akun saya hilang jadi Akun New player. Tolong dibantu buat recovery akunnya developer, soalny punya akun udh pernah topup pas dibuka tiba² hilang akunnya kan ngeselin",1,18,4.4.43,2023-01-25 18:52:07,,,4.4.43
522,921bc3d0-da91-42e2-a693-aa3ca364935c,Abdi Rodhial Mega,https://play-lh.googleusercontent.com/a-/ALV-UjW51s4vRTdYiTshPD59P932upYEY4YoD4u-hjjcz39Xpw,"Tambahan untuk koin saat memenangkan race online dong, soalnya setiap race dikit banget dapetnya sedangkan untuk upgrade mobil dan mesin setiap level uangnya nambah terus jadi tolong tambahan untuk koin nya",5,0,,2022-06-30 07:50:48,,,
523,21bdc6a9-f002-4250-9095-d6cdcb3e3c7a,Daniel Dito Aritonang PK 4,https://play-lh.googleusercontent.com/a/ACg8ocI7Il7kj0UTTeKm4mLQW1lZGica9SXB6BIufcH8799r=mo,"1. Perbaiki peraturan pinalti track limit, lebih baik dikurangi waktu nya daripada kecepatan nya yang dikurangi. 2. Permudah pemulihan mobil setelah balapan 3. Adakan pit stop saat sedang balapan",1,0,,2022-05-02 05:50:33,,,
524,c3331643-8ad5-47a0-9f09-e36bbaae489e,Stevanus 24,https://play-lh.googleusercontent.com/a-/ALV-UjWwwcvSlbW6Fu3ikLQEOr1VZ31V5-IoRcdsbG95WIOBiw,"Aku kasih bintang 4 dulu yah, aku mau kalo nanti di versi terbaru ada mode Champions atau ga mode balapan offline gitu biar lebih kaya balapan aslinya gitu, ga apa"" deh nambah 1 giga kan biar makin bagus juga :')",4,19,3.1.5,2021-11-14 14:38:29,,,3.1.5
525,66e95c37-c304-4dbc-902e-2d7786d01f6e,Pengguna Google,https://play-lh.googleusercontent.com/EGemoI2NTXmTsBVtJqk8jxF9rh8ApRWfsIMQSt2uE4OcpQqbFu7f7NbTK05lx80nuSijCz7sc3a277R67g,Game bagus tapi tolong untuk jaringan padahal sudah pake WiFi jaringan empat /full tapi koneksi nya suka terputus sendiri .(｡•̀ᴗ-)✧trims,4,6,1.18.16,2019-12-03 05:29:49,,,1.18.16
526,02fe7c52-ac4d-49b2-b93a-44ccebd7c88f,Asep Gunawan,https://play-lh.googleusercontent.com/a-/ALV-UjWZv_vEL_aPuC2VMEpjs-9-PTHDv6O9wz-CHBvRwV9n2io,"Sangat disayangkan tidak ada mode single player, dan tentunya kontrol mobil masih kaku. Kenapa? Kan sudah bekerjasama dengan EA kok masih gituh. Kalo masih di development oleh codemaster seorang sudah tidak aneh, ini lho sama EA masih gitu"" ajah... COME ON!!!!",3,22,3.2.18,2021-12-15 01:20:02,,,3.2.18
527,280b3595-2f98-48d1-9faf-12793c6c30ac,Pengguna Google,https://play-lh.googleusercontent.com/EGemoI2NTXmTsBVtJqk8jxF9rh8ApRWfsIMQSt2uE4OcpQqbFu7f7NbTK05lx80nuSijCz7sc3a277R67g,"sebenarnya sangat seru,tapi dari admin di buat curang, kalau mobil dapat beli walaupun keluar lintasan masih bisa kencang lari,sedangkan yang masih pakai gratisan setiap keluar lintasan langsung berhenti",2,20,1.10.4,2019-05-27 12:52:03,,,1.10.4
528,fa290f47-5e80-4d19-8ac5-9aa2d9ae6dce,trisno putra,https://play-lh.googleusercontent.com/a/ACg8ocKsUtEL495NjAdlyn14hxHnLq41IzfK1VrEyP0joCem=mo,"Ini game real dan asyik, tapi selalu maksa gunain koin untuk repair part/upgrade part mobilnya, meskipun ad opsi free dengan syarat tonton video, tetap aja ga bisa",3,0,3.6.22,2022-06-29 23:23:03,,,3.6.22
529,15efbf4b-fbbe-44e2-81f7-35b0040bd6ee,Jason Kirana,https://play-lh.googleusercontent.com/a/ACg8ocLa56_PSg6UACQ1ODGvosw-to5SSKH6HBQJWwyvya0MNA=mo,"grafiknya perfect gameplaynya oke banget, tapi kok kalau kita buka pop up atau aplikasi lain dalam jendela pop up kok reconect trs ya dibenerin ya bia game ini makin perfect",5,0,4.3.19,2022-11-16 13:15:08,,,4.3.19
530,9f94c1d4-ef75-4672-b805-bd4b2a241496,Pengguna Google,https://play-lh.googleusercontent.com/EGemoI2NTXmTsBVtJqk8jxF9rh8ApRWfsIMQSt2uE4OcpQqbFu7f7NbTK05lx80nuSijCz7sc3a277R67g,"Ada info disuruh update, saya update sampe kurang berapa persen ada pemberitahuan proses gagal 192, saya kira mungkin sinyal data saya yang jelek, saya ulangi lagi update ternyata sama aja tetap g bisa di update dengan masalah yang sama 192",2,6,1.6.26,2019-02-24 10:24:06,,,1.6.26
531,170aa2a9-73c7-4977-840b-4b62533bdcf1,Pengguna Google,https://play-lh.googleusercontent.com/EGemoI2NTXmTsBVtJqk8jxF9rh8ApRWfsIMQSt2uE4OcpQqbFu7f7NbTK05lx80nuSijCz7sc3a277R67g,"Saya kasih bintang 2 dulu, karna saya sangat kecewa dengan aplikasi ini sekarang, yang mana download lama, dan setelah download selai, aplikasi mentok di load,jaringan saya udah 4G tapi kenapa gitu2 aj. Saya mohon ke pihak aplikasi ini. Tolong di perbaiki lagi. Soal ny saya udah dua kali download dan masih sama",2,1,1.5.8,2019-02-02 13:39:05,,,1.5.8
532,aae0bb67-c3d0-4137-b115-d441d91ed568,J FC,https://play-lh.googleusercontent.com/a/ACg8ocIBb3oY0QrHfWSLdvdQ5cwJmiVTl7TxYA7SzNNpqaRn=mo,"Game bagus tapi waktu duel lawan keluar lintasan mobil masih tetep bisa lari kencang,,sedangkan kita keluar dikit aja pelanggaran,,meskipun musuh cuma bayangan tp menurutku balapan nya kurang adilll",1,0,,2021-01-14 15:23:38,,,
533,e6fa7d45-1be5-4a11-9114-7e8bc1e033da,Anggara Murdianto,https://play-lh.googleusercontent.com/a-/ALV-UjUV8-YmjvmNUVSEACUe9qV6_T_MW_WA6fRArgzE52tBAA,Overal bagus tapi ada yg masih kurang. Contohnya penontonnya dan masuk ke dalam pit stop belum ada di game ini dan jga untuk beli mobil sekelas marcedes atau verarri itu terlalu mahal,3,0,,2020-11-21 04:13:05,,,
534,9e39d12b-c034-4e6d-8f0e-559873a9f433,Ragel Selatan,https://play-lh.googleusercontent.com/a-/ALV-UjX-o3dc_9tVXQKcUAuir3_O9IWkuFa3F3ufFD1CtH-QjJ4,"Tak kasih bintang 3 dulu,.gamenya memang bagus tapi sayangnya suaranya kadang hilang sendiri,.tolong di perbaiki suaranya,..masak balapan gak ada suaranya.",3,2,1.22.8,2020-04-29 21:33:43,,,1.22.8
535,0b304fd9-ec76-4a25-8e62-8bd33d42ba1b,uzumaki nur,https://play-lh.googleusercontent.com/a-/ALV-UjUInu2kxRTCpK4OhwpQK_AgjwoBG9V3yju4z9vTVXIXHqI,"Gamenya sudah sangat bagus grafiknya juga, tapi tolong di mode duel perbaiki lagi u pemilihan lawan. mobil yang gratisan jangan samain sama mobil yang boleh beli bakal kalah jauh kecepatanya.",4,0,3.6.22,2022-06-22 07:28:33,,,3.6.22
536,0c015425-a7fe-45c7-94b6-8b8c3e7a1eaa,MHS Channel,https://play-lh.googleusercontent.com/a-/ALV-UjXhj6DbZ2NQsZALd5z45ojEAJIWI4FKOL7659LFy_jr0iM,Game Sangat Buruk yg pernah dicoba. Setiap login selalu reconnecting internet. Padahal kecepatan internet stabil di 2 mbps. Udah gitu bikin ngerusak ke layar hp.. Layar hp tiba² kedip².. Game Luck Nuth..,1,1,,2022-09-22 13:02:56,,,
537,53061201-b3ea-40fd-99c4-7f371a5fdfa7,Pengguna Google,https://play-lh.googleusercontent.com/EGemoI2NTXmTsBVtJqk8jxF9rh8ApRWfsIMQSt2uE4OcpQqbFu7f7NbTK05lx80nuSijCz7sc3a277R67g,kenapa iklannya maksa banget ya video lagi durasi 30 detik gk bisa di skip. gamenya online juga iya klo offline wajar jadi kurang yg awalnya bagus gara2 iklan malah jadi burik,1,5,1.9.24,2019-05-17 03:31:52,,,1.9.24
538,dda56ca6-ec6d-4fcd-967b-0a3a0b05bdf2,Ignatius Richelle orlando,https://play-lh.googleusercontent.com/a-/ALV-UjU-QJg8v8X-fzeyxB30crDsxOSATHiNdkhd6CdfFl8fsw,Secara keseluruhan dari game bagus tapi saya berharap update nantinya grafik di per bagus sepertinya komen dari orang lain benar dulu lebih bagus ketimbang grafik skarang jadi intinya plis tambahkan grafiknya,4,0,3.0.26,2021-10-14 06:16:48,,,3.0.26
539,8718e346-4ac4-48a5-a1f0-b3dd2f17ec4d,Pengguna Google,https://play-lh.googleusercontent.com/EGemoI2NTXmTsBVtJqk8jxF9rh8ApRWfsIMQSt2uE4OcpQqbFu7f7NbTK05lx80nuSijCz7sc3a277R67g,"Keseluruhan bagus. Cuman ada beberapa sirkuit yg masih kasar, tiba-tiba nge lag pada saat race, dan iklan sangat mengganggu.",5,3,1.16.12,2019-09-27 18:23:05,,,1.16.12
540,7bbfdefd-c1b7-42ec-a259-92f45d4b5be1,Depi Muhamad,https://play-lh.googleusercontent.com/a-/ALV-UjUMp71KG0AEz8RtffSWPS_RprBhrC3D7PikCfIuStQZ1jk,"Hilangin lag nya dong dan tambahin juga settingan grafiknya agar bisa di atur sesuai device hp nya terus adain juga pit stop biar kaya F1 beneran, kukira gamenya offline ternyata menggunakan koneksi internet/online, pliss tabahin fitur fitur tersebut ya😘🤗🙏🙏",3,23,2.7.6,2021-06-27 11:31:33,,,2.7.6
